    1 0.000000000 128.105.145.229 → 128.105.145.227 TCP 1514 47476 → 6800 [ACK] Seq=1 Ack=1 Win=501 Len=1448 TSval=3586517003 TSecr=226649537
    2 0.000032522 128.105.145.227 → 128.105.145.229 TCP 66 6800 → 47476 [ACK] Seq=1 Ack=1449 Win=586 Len=0 TSval=226654538 TSecr=3586517003
    3 0.000232969 128.105.145.229 → 128.105.145.227 TCP 1066 47476 → 6800 [PSH, ACK] Seq=1449 Ack=1 Win=501 Len=1000 TSval=3586517003 TSecr=226649537
    4 0.000233169 128.105.145.229 → 128.105.145.227 TCP 1218 47476 → 6800 [PSH, ACK] Seq=2449 Ack=1 Win=501 Len=1152 TSval=3586517003 TSecr=226649537
    5 0.000259239 128.105.145.227 → 128.105.145.229 TCP 66 6800 → 47476 [ACK] Seq=1 Ack=2449 Win=586 Len=0 TSval=226654538 TSecr=3586517003
    6 0.000277056 128.105.145.227 → 128.105.145.229 TCP 66 6800 → 47476 [ACK] Seq=1 Ack=3601 Win=578 Len=0 TSval=226654538 TSecr=3586517003
    7 0.351726157 128.105.145.228 → 128.105.145.227 TCP 510 58034 → 6804 [PSH, ACK] Seq=1 Ack=1 Win=17301 Len=444 TSval=1039161108 TSecr=1180960110
    8 0.351764289 128.105.145.227 → 128.105.145.228 TCP 66 6804 → 58034 [ACK] Seq=1 Ack=445 Win=2358 Len=0 TSval=1180960761 TSecr=1039161108
    9 0.351962895 128.105.145.227 → 128.105.145.228 TCP 110 6804 → 58034 [PSH, ACK] Seq=1 Ack=445 Win=2358 Len=44 TSval=1180960762 TSecr=1039161108
   10 0.352050277 128.105.145.227 → 128.105.145.228 TCP 462 6804 → 58034 [PSH, ACK] Seq=45 Ack=445 Win=2358 Len=396 TSval=1180960762 TSecr=1039161108
   11 0.352204218 128.105.145.228 → 128.105.145.227 TCP 66 58034 → 6804 [ACK] Seq=445 Ack=45 Win=17301 Len=0 TSval=1039161108 TSecr=1180960762
   12 0.352452243 128.105.145.228 → 128.105.145.227 TCP 66 58034 → 6804 [ACK] Seq=445 Ack=441 Win=17301 Len=0 TSval=1039161109 TSecr=1180960762
   13 0.352704663 128.105.145.228 → 128.105.145.227 TCP 110 58034 → 6804 [PSH, ACK] Seq=445 Ack=441 Win=17301 Len=44 TSval=1039161109 TSecr=1180960762
   14 0.359842284 128.105.145.227 → 128.105.145.228 TCP 362 6804 → 58034 [PSH, ACK] Seq=441 Ack=489 Win=2358 Len=296 TSval=1180960769 TSecr=1039161109
   15 0.359895453 128.105.145.227 → 128.105.145.229 TCP 362 60638 → 6802 [PSH, ACK] Seq=1 Ack=1 Win=633 Len=296 TSval=226654897 TSecr=3586509407
   16 0.360081772 128.105.145.228 → 128.105.145.227 TCP 66 58034 → 6804 [ACK] Seq=489 Ack=737 Win=17301 Len=0 TSval=1039161116 TSecr=1180960769
   17 0.360108992 128.105.145.229 → 128.105.145.227 TCP 66 6802 → 60638 [ACK] Seq=1 Ack=297 Win=1483 Len=0 TSval=3586517364 TSecr=226654897
   18 0.360323085 128.105.145.228 → 128.105.145.227 TCP 110 58034 → 6804 [PSH, ACK] Seq=489 Ack=737 Win=17301 Len=44 TSval=1039161116 TSecr=1180960769
   19 0.360323302 128.105.145.228 → 128.105.145.227 TCP 198 58034 → 6804 [PSH, ACK] Seq=533 Ack=737 Win=17301 Len=132 TSval=1039161116 TSecr=1180960769
   20 0.360348450 128.105.145.229 → 128.105.145.227 TCP 110 6802 → 60638 [PSH, ACK] Seq=1 Ack=297 Win=1483 Len=44 TSval=3586517364 TSecr=226654897
   21 0.360421431 128.105.145.227 → 128.105.145.228 TCP 66 6804 → 58034 [ACK] Seq=737 Ack=665 Win=2358 Len=0 TSval=1180960770 TSecr=1039161116
   22 0.360516652 128.105.145.227 → 128.105.145.228 TCP 110 6804 → 58034 [PSH, ACK] Seq=737 Ack=665 Win=2358 Len=44 TSval=1180960770 TSecr=1039161116
   23 0.360556475 128.105.145.228 → 128.105.145.227 TCP 198 58034 → 6804 [PSH, ACK] Seq=665 Ack=737 Win=17301 Len=132 TSval=1039161117 TSecr=1180960770
   24 0.360593860 128.105.145.229 → 128.105.145.227 TCP 330 6802 → 60638 [PSH, ACK] Seq=45 Ack=297 Win=1483 Len=264 TSval=3586517364 TSecr=226654897
   25 0.360641886 128.105.145.227 → 128.105.145.229 TCP 66 60638 → 6802 [ACK] Seq=297 Ack=309 Win=633 Len=0 TSval=226654898 TSecr=3586517364
   26 0.360686428 128.105.145.227 → 128.105.145.228 TCP 110 6804 → 58034 [PSH, ACK] Seq=781 Ack=797 Win=2358 Len=44 TSval=1180960770 TSecr=1039161117
   27 0.360770204 128.105.145.228 → 128.105.145.227 TCP 66 58034 → 6804 [ACK] Seq=797 Ack=781 Win=17301 Len=0 TSval=1039161117 TSecr=1180960770
   28 0.360801367 128.105.145.227 → 128.105.145.229 TCP 110 60638 → 6802 [PSH, ACK] Seq=297 Ack=309 Win=633 Len=44 TSval=226654898 TSecr=3586517364
   29 0.360960179 128.105.145.229 → 128.105.145.227 TCP 66 6802 → 60638 [ACK] Seq=309 Ack=341 Win=1483 Len=0 TSval=3586517365 TSecr=226654898
   30 0.361049600 128.105.145.228 → 128.105.145.227 TCP 66 58034 → 6804 [ACK] Seq=797 Ack=825 Win=17301 Len=0 TSval=1039161117 TSecr=1180960770
   31 0.491768285 128.105.145.228 → 128.105.145.227 TCP 1514 58372 → 6800 [ACK] Seq=1 Ack=1 Win=501 Len=1448 TSval=1039161248 TSecr=1180955901
   32 0.491795923 128.105.145.227 → 128.105.145.228 TCP 66 6800 → 58372 [ACK] Seq=1 Ack=1449 Win=586 Len=0 TSval=1180960901 TSecr=1039161248
   33 0.491976515 128.105.145.228 → 128.105.145.227 TCP 1066 58372 → 6800 [PSH, ACK] Seq=1449 Ack=1 Win=501 Len=1000 TSval=1039161248 TSecr=1180955901
   34 0.491976698 128.105.145.228 → 128.105.145.227 TCP 1514 58372 → 6800 [ACK] Seq=2449 Ack=1 Win=501 Len=1448 TSval=1039161248 TSecr=1180955901
   35 0.491998825 128.105.145.227 → 128.105.145.228 TCP 66 6800 → 58372 [ACK] Seq=1 Ack=2449 Win=586 Len=0 TSval=1180960902 TSecr=1039161248
   36 0.492014500 128.105.145.227 → 128.105.145.228 TCP 66 6800 → 58372 [ACK] Seq=1 Ack=3897 Win=578 Len=0 TSval=1180960902 TSecr=1039161248
   37 0.492233953 128.105.145.228 → 128.105.145.227 TCP 2962 58372 → 6800 [ACK] Seq=3897 Ack=1 Win=501 Len=2896 TSval=1039161248 TSecr=1180955901
   38 0.492256829 128.105.145.227 → 128.105.145.228 TCP 66 6800 → 58372 [ACK] Seq=1 Ack=6793 Win=578 Len=0 TSval=1180960902 TSecr=1039161248
   39 0.492480154 128.105.145.228 → 128.105.145.227 TCP 1338 58372 → 6800 [PSH, ACK] Seq=6793 Ack=1 Win=501 Len=1272 TSval=1039161248 TSecr=1180955901
   40 0.492502124 128.105.145.227 → 128.105.145.228 TCP 66 6800 → 58372 [ACK] Seq=1 Ack=8065 Win=586 Len=0 TSval=1180960902 TSecr=1039161248
   41 0.520457682 128.105.145.227 → 128.105.145.229 SSH 102 Client: Encrypted packet (len=36)
   42 0.521278482 128.105.145.227 → 128.105.145.229 SSH 102 Client: Encrypted packet (len=36)
   43 0.521465236 128.105.145.229 → 128.105.145.227 TCP 66 22 → 56334 [ACK] Seq=1 Ack=73 Win=501 Len=0 TSval=3586517525 TSecr=226655058
   44 0.521676626 128.105.145.229 → 128.105.145.227 SSH 102 Server: Encrypted packet (len=36)
   45 0.521689397 128.105.145.227 → 128.105.145.229 TCP 66 56334 → 22 [ACK] Seq=73 Ack=37 Win=501 Len=0 TSval=226655059 TSecr=3586517525
   46 0.523560769 128.105.145.227 → 128.105.145.228 SSH 102 Client: Encrypted packet (len=36)
   47 0.524261885 128.105.145.227 → 128.105.145.228 SSH 102 Client: Encrypted packet (len=36)
   48 0.524634590 128.105.145.228 → 128.105.145.227 TCP 66 22 → 56880 [ACK] Seq=1 Ack=73 Win=501 Len=0 TSval=1039161281 TSecr=1180960933
   49 0.524634787 128.105.145.228 → 128.105.145.227 SSH 94 Server: Encrypted packet (len=28)
   50 0.524667834 128.105.145.227 → 128.105.145.228 TCP 66 56880 → 22 [ACK] Seq=73 Ack=29 Win=501 Len=0 TSval=1180960934 TSecr=1039161281
   51 0.529779338 128.105.145.227 → 128.105.145.229 SSH 102 Client: Encrypted packet (len=36)
   52 0.530497088 128.105.145.227 → 128.105.145.229 SSH 102 Client: Encrypted packet (len=36)
   53 0.530687561 128.105.145.229 → 128.105.145.227 TCP 66 22 → 56326 [ACK] Seq=1 Ack=73 Win=501 Len=0 TSval=3586517534 TSecr=226655067
   54 0.530897484 128.105.145.229 → 128.105.145.227 SSH 102 Server: Encrypted packet (len=36)
   55 0.530914839 128.105.145.227 → 128.105.145.229 TCP 66 56326 → 22 [ACK] Seq=73 Ack=37 Win=501 Len=0 TSval=226655068 TSecr=3586517534
   56 1.076257787 128.105.145.227 → 128.105.145.228 TCP 74 40280 → 9100 [SYN] Seq=0 Win=64240 Len=0 MSS=1460 SACK_PERM=1 TSval=1180961486 TSecr=0 WS=128
   57 1.076425140 128.105.145.228 → 128.105.145.227 TCP 60 9100 → 40280 [RST, ACK] Seq=1 Ack=1 Win=0 Len=0
   58 1.452477966 128.105.145.227 → 128.105.145.229 TCP 2189 45564 → 6806 [PSH, ACK] Seq=1 Ack=1 Win=10016 Len=2123 TSval=226655990 TSecr=3586515557
   59 1.452485310 128.105.145.227 → 128.105.145.229 TCP 2189 37158 → 6804 [PSH, ACK] Seq=1 Ack=1 Win=10226 Len=2123 TSval=226655990 TSecr=3586515556
   60 1.452510702 128.105.145.227 → 128.105.145.229 TCP 2189 34196 → 6812 [PSH, ACK] Seq=1 Ack=1 Win=10226 Len=2123 TSval=226655990 TSecr=3586515557
   61 1.452519757 128.105.145.227 → 128.105.145.229 TCP 2189 59512 → 6814 [PSH, ACK] Seq=1 Ack=1 Win=10226 Len=2123 TSval=226655990 TSecr=3586515557
   62 1.452541991 128.105.145.227 → 128.105.145.228 TCP 2189 34052 → 6806 [PSH, ACK] Seq=1 Ack=1 Win=10226 Len=2123 TSval=1180961862 TSecr=1039159310
   63 1.452543124 128.105.145.227 → 128.105.145.228 TCP 2189 53064 → 6804 [PSH, ACK] Seq=1 Ack=1 Win=10226 Len=2123 TSval=1180961862 TSecr=1039159310
   64 1.452571637 128.105.145.227 → 128.105.145.228 TCP 2189 43468 → 6812 [PSH, ACK] Seq=1 Ack=1 Win=10226 Len=2123 TSval=1180961862 TSecr=1039159310
   65 1.452575242 128.105.145.227 → 128.105.145.228 TCP 2189 33818 → 6814 [PSH, ACK] Seq=1 Ack=1 Win=10226 Len=2123 TSval=1180961862 TSecr=1039159310
   66 1.453076510 128.105.145.229 → 128.105.145.227 TCP 66 6806 → 45564 [ACK] Seq=1 Ack=2124 Win=10016 Len=0 TSval=3586518457 TSecr=226655990
   67 1.453478579 128.105.145.229 → 128.105.145.227 TCP 1514 6806 → 45564 [ACK] Seq=1 Ack=2124 Win=10016 Len=1448 TSval=3586518457 TSecr=226655990
   68 1.453501371 128.105.145.227 → 128.105.145.229 TCP 66 45564 → 6806 [ACK] Seq=2124 Ack=1449 Win=10016 Len=0 TSval=226655991 TSecr=3586518457
   69 1.453535979 128.105.145.229 → 128.105.145.227 TCP 66 6804 → 37158 [ACK] Seq=1 Ack=2124 Win=10214 Len=0 TSval=3586518457 TSecr=226655990
   70 1.453717814 128.105.145.229 → 128.105.145.227 TCP 741 6806 → 45564 [PSH, ACK] Seq=1449 Ack=2124 Win=10016 Len=675 TSval=3586518457 TSecr=226655990
   71 1.453734865 128.105.145.229 → 128.105.145.227 TCP 66 6814 → 59512 [ACK] Seq=1 Ack=2124 Win=10016 Len=0 TSval=3586518457 TSecr=226655990
   72 1.453739917 128.105.145.227 → 128.105.145.229 TCP 66 45564 → 6806 [ACK] Seq=2124 Ack=2124 Win=10016 Len=0 TSval=226655991 TSecr=3586518457
   73 1.453761537 128.105.145.229 → 128.105.145.227 TCP 66 6812 → 34196 [ACK] Seq=1 Ack=2124 Win=10016 Len=0 TSval=3586518457 TSecr=226655990
   74 1.453785204 128.105.145.229 → 128.105.145.227 TCP 2189 6804 → 37158 [PSH, ACK] Seq=1 Ack=2124 Win=10214 Len=2123 TSval=3586518457 TSecr=226655990
   75 1.453815905 128.105.145.227 → 128.105.145.229 TCP 66 37158 → 6804 [ACK] Seq=2124 Ack=2124 Win=10218 Len=0 TSval=226655991 TSecr=3586518457
   76 1.454033671 128.105.145.229 → 128.105.145.227 TCP 2189 6812 → 34196 [PSH, ACK] Seq=1 Ack=2124 Win=10016 Len=2123 TSval=3586518457 TSecr=226655990
   77 1.454033888 128.105.145.228 → 128.105.145.227 TCP 66 6804 → 53064 [ACK] Seq=1 Ack=2124 Win=10016 Len=0 TSval=1039162210 TSecr=1180961862
   78 1.454072318 128.105.145.227 → 128.105.145.229 TCP 66 34196 → 6812 [ACK] Seq=2124 Ack=2124 Win=10218 Len=0 TSval=226655992 TSecr=3586518457
   79 1.454232921 128.105.145.229 → 128.105.145.227 TCP 2189 6814 → 59512 [PSH, ACK] Seq=1 Ack=2124 Win=10016 Len=2123 TSval=3586518457 TSecr=226655990
   80 1.454273072 128.105.145.227 → 128.105.145.229 TCP 66 59512 → 6814 [ACK] Seq=2124 Ack=2124 Win=10218 Len=0 TSval=226655992 TSecr=3586518457
   81 1.454280159 128.105.145.228 → 128.105.145.227 TCP 2189 6804 → 53064 [PSH, ACK] Seq=1 Ack=2124 Win=10016 Len=2123 TSval=1039162210 TSecr=1180961862
   82 1.454306363 128.105.145.227 → 128.105.145.228 TCP 66 53064 → 6804 [ACK] Seq=2124 Ack=2124 Win=10218 Len=0 TSval=1180961864 TSecr=1039162210
   83 1.454312191 128.105.145.228 → 128.105.145.227 TCP 66 6806 → 34052 [ACK] Seq=1 Ack=2124 Win=10016 Len=0 TSval=1039162210 TSecr=1180961862
   84 1.454501477 128.105.145.228 → 128.105.145.227 TCP 66 6814 → 33818 [ACK] Seq=1 Ack=2124 Win=10214 Len=0 TSval=1039162210 TSecr=1180961862
   85 1.454548912 128.105.145.228 → 128.105.145.227 TCP 2189 6806 → 34052 [PSH, ACK] Seq=1 Ack=2124 Win=10016 Len=2123 TSval=1039162210 TSecr=1180961862
   86 1.454549123 128.105.145.228 → 128.105.145.227 TCP 66 6812 → 43468 [ACK] Seq=1 Ack=2124 Win=10214 Len=0 TSval=1039162210 TSecr=1180961862
   87 1.454585681 128.105.145.227 → 128.105.145.228 TCP 66 34052 → 6806 [ACK] Seq=2124 Ack=2124 Win=10218 Len=0 TSval=1180961864 TSecr=1039162210
   88 1.454760249 128.105.145.228 → 128.105.145.227 TCP 2189 6812 → 43468 [PSH, ACK] Seq=1 Ack=2124 Win=10214 Len=2123 TSval=1039162210 TSecr=1180961862
   89 1.454774025 128.105.145.227 → 128.105.145.228 TCP 66 43468 → 6812 [ACK] Seq=2124 Ack=2124 Win=10218 Len=0 TSval=1180961864 TSecr=1039162210
   90 1.454814754 128.105.145.228 → 128.105.145.227 TCP 1514 6814 → 33818 [ACK] Seq=1 Ack=2124 Win=10214 Len=1448 TSval=1039162210 TSecr=1180961862
   91 1.454837977 128.105.145.227 → 128.105.145.228 TCP 66 33818 → 6814 [ACK] Seq=2124 Ack=1449 Win=10226 Len=0 TSval=1180961864 TSecr=1039162210
   92 1.455020882 128.105.145.228 → 128.105.145.227 TCP 741 6814 → 33818 [PSH, ACK] Seq=1449 Ack=2124 Win=10214 Len=675 TSval=1039162210 TSecr=1180961862
   93 1.455028661 128.105.145.227 → 128.105.145.228 TCP 66 33818 → 6814 [ACK] Seq=2124 Ack=2124 Win=10226 Len=0 TSval=1180961865 TSecr=1039162210
   94 1.751131952 128.105.145.229 → 128.105.145.227 TCP 162 58002 → 3300 [PSH, ACK] Seq=1 Ack=1 Win=2696 Len=96 TSval=3586518755 TSecr=226646287
   95 1.751288803 128.105.145.227 → 128.105.145.229 TCP 162 3300 → 58002 [PSH, ACK] Seq=1 Ack=97 Win=682 Len=96 TSval=226656289 TSecr=3586518755
   96 1.751474982 128.105.145.229 → 128.105.145.227 TCP 66 58002 → 3300 [ACK] Seq=97 Ack=97 Win=2696 Len=0 TSval=3586518755 TSecr=226656289
   97 2.001830782 128.105.145.227 → 128.105.145.229 SSH 102 Client: Encrypted packet (len=36)
   98 2.002579297 128.105.145.227 → 128.105.145.229 SSH 102 Client: Encrypted packet (len=36)
   99 2.002770167 128.105.145.229 → 128.105.145.227 TCP 66 22 → 44456 [ACK] Seq=1 Ack=73 Win=501 Len=0 TSval=3586519006 TSecr=226656539
  100 2.002981995 128.105.145.229 → 128.105.145.227 SSH 102 Server: Encrypted packet (len=36)
  101 2.002994665 128.105.145.227 → 128.105.145.229 TCP 66 44456 → 22 [ACK] Seq=73 Ack=37 Win=501 Len=0 TSval=226656541 TSecr=3586519006
  102 2.003498001 128.105.145.227 → 128.105.145.229 SSH 102 Client: Encrypted packet (len=36)
  103 2.004188304 128.105.145.227 → 128.105.145.229 SSH 102 Client: Encrypted packet (len=36)
  104 2.004380665 128.105.145.229 → 128.105.145.227 TCP 66 22 → 44468 [ACK] Seq=1 Ack=73 Win=501 Len=0 TSval=3586519008 TSecr=226656541
  105 2.004591988 128.105.145.229 → 128.105.145.227 SSH 102 Server: Encrypted packet (len=36)
  106 2.004611021 128.105.145.227 → 128.105.145.229 TCP 66 44468 → 22 [ACK] Seq=73 Ack=37 Win=501 Len=0 TSval=226656542 TSecr=3586519008
  107 2.005079556 128.105.145.227 → 128.105.145.229 SSH 102 Client: Encrypted packet (len=36)
  108 2.005762571 128.105.145.227 → 128.105.145.229 SSH 102 Client: Encrypted packet (len=36)
  109 2.005980278 128.105.145.229 → 128.105.145.227 TCP 66 22 → 44490 [ACK] Seq=1 Ack=73 Win=501 Len=0 TSval=3586519010 TSecr=226656543
  110 2.006194318 128.105.145.229 → 128.105.145.227 SSH 102 Server: Encrypted packet (len=36)
  111 2.006209838 128.105.145.227 → 128.105.145.229 TCP 66 44490 → 22 [ACK] Seq=73 Ack=37 Win=501 Len=0 TSval=226656544 TSecr=3586519010
  112 2.008582139 128.105.145.227 → 128.105.145.229 SSH 102 Client: Encrypted packet (len=36)
  113 2.009301516 128.105.145.227 → 128.105.145.229 SSH 102 Client: Encrypted packet (len=36)
  114 2.009564428 128.105.145.229 → 128.105.145.227 TCP 66 22 → 56346 [ACK] Seq=1 Ack=73 Win=501 Len=0 TSval=3586519013 TSecr=226656546
  115 2.009564659 128.105.145.229 → 128.105.145.227 SSH 102 Server: Encrypted packet (len=36)
  116 2.009597752 128.105.145.227 → 128.105.145.229 TCP 66 56346 → 22 [ACK] Seq=73 Ack=37 Win=501 Len=0 TSval=226656547 TSecr=3586519013
  117 2.011217182 128.105.145.227 → 128.105.145.229 SSH 102 Client: Encrypted packet (len=36)
  118 2.011907933 128.105.145.227 → 128.105.145.229 SSH 102 Client: Encrypted packet (len=36)
  119 2.012104130 128.105.145.229 → 128.105.145.227 TCP 66 22 → 44484 [ACK] Seq=1 Ack=73 Win=501 Len=0 TSval=3586519016 TSecr=226656549
  120 2.012345646 128.105.145.229 → 128.105.145.227 SSH 102 Server: Encrypted packet (len=36)
  121 2.012372642 128.105.145.227 → 128.105.145.229 TCP 66 44484 → 22 [ACK] Seq=73 Ack=37 Win=501 Len=0 TSval=226656550 TSecr=3586519016
  122 2.013636886 128.105.145.227 → 128.105.145.228 SSH 102 Client: Encrypted packet (len=36)
  123 2.014046776 128.105.145.227 → 128.105.145.228 SSH 102 Client: Encrypted packet (len=36)
  124 2.014208554 128.105.145.228 → 128.105.145.227 TCP 66 22 → 56828 [ACK] Seq=1 Ack=73 Win=501 Len=0 TSval=1039162770 TSecr=1180962423
  125 2.014420602 128.105.145.228 → 128.105.145.227 SSH 102 Server: Encrypted packet (len=36)
  126 2.014431125 128.105.145.227 → 128.105.145.228 TCP 66 56828 → 22 [ACK] Seq=73 Ack=37 Win=501 Len=0 TSval=1180962424 TSecr=1039162770
  127 2.015214195 128.105.145.227 → 128.105.145.228 SSH 102 Client: Encrypted packet (len=36)
  128 2.015622521 128.105.145.227 → 128.105.145.228 SSH 102 Client: Encrypted packet (len=36)
  129 2.015822123 128.105.145.228 → 128.105.145.227 TCP 66 22 → 49588 [ACK] Seq=1 Ack=73 Win=501 Len=0 TSval=1039162772 TSecr=1180962425
  130 2.016035063 128.105.145.228 → 128.105.145.227 SSH 102 Server: Encrypted packet (len=36)
  131 2.016051807 128.105.145.227 → 128.105.145.228 TCP 66 49588 → 22 [ACK] Seq=73 Ack=37 Win=501 Len=0 TSval=1180962426 TSecr=1039162772
  132 2.016141041 128.105.145.227 → 128.105.145.228 SSH 102 Client: Encrypted packet (len=36)
  133 2.016548430 128.105.145.227 → 128.105.145.228 SSH 102 Client: Encrypted packet (len=36)
  134 2.016781603 128.105.145.228 → 128.105.145.227 TCP 66 22 → 56830 [ACK] Seq=1 Ack=73 Win=501 Len=0 TSval=1039162773 TSecr=1180962426
  135 2.016994136 128.105.145.228 → 128.105.145.227 SSH 102 Server: Encrypted packet (len=36)
  136 2.017009199 128.105.145.227 → 128.105.145.228 TCP 66 56830 → 22 [ACK] Seq=73 Ack=37 Win=501 Len=0 TSval=1180962427 TSecr=1039162773
  137 2.017764954 128.105.145.227 → 128.105.145.228 SSH 102 Client: Encrypted packet (len=36)
  138 2.018193649 128.105.145.227 → 128.105.145.228 SSH 102 Client: Encrypted packet (len=36)
  139 2.018399987 128.105.145.228 → 128.105.145.227 TCP 66 22 → 49594 [ACK] Seq=1 Ack=73 Win=501 Len=0 TSval=1039162775 TSecr=1180962427
  140 2.018642382 128.105.145.228 → 128.105.145.227 SSH 102 Server: Encrypted packet (len=36)
  141 2.018655469 128.105.145.227 → 128.105.145.228 TCP 66 49594 → 22 [ACK] Seq=73 Ack=37 Win=501 Len=0 TSval=1180962428 TSecr=1039162775
  142 2.018776343 128.105.145.227 → 128.105.145.229 SSH 102 Client: Encrypted packet (len=36)
  143 2.019183585 128.105.145.227 → 128.105.145.229 SSH 102 Client: Encrypted packet (len=36)
  144 2.019405596 128.105.145.229 → 128.105.145.227 TCP 66 22 → 44506 [ACK] Seq=1 Ack=73 Win=901 Len=0 TSval=3586519023 TSecr=226656556
  145 2.019616899 128.105.145.229 → 128.105.145.227 SSH 102 Server: Encrypted packet (len=36)
  146 2.019631581 128.105.145.227 → 128.105.145.229 TCP 66 44506 → 22 [ACK] Seq=73 Ack=37 Win=501 Len=0 TSval=226656557 TSecr=3586519023
  147 2.019700412 128.105.145.227 → 128.105.145.228 SSH 102 Client: Encrypted packet (len=36)
  148 2.020128171 128.105.145.227 → 128.105.145.228 SSH 102 Client: Encrypted packet (len=36)
  149 2.020360786 128.105.145.228 → 128.105.145.227 TCP 66 22 → 56838 [ACK] Seq=1 Ack=73 Win=501 Len=0 TSval=1039162776 TSecr=1180962429
  150 2.020572984 128.105.145.228 → 128.105.145.227 SSH 102 Server: Encrypted packet (len=36)
  151 2.020590637 128.105.145.227 → 128.105.145.228 TCP 66 56838 → 22 [ACK] Seq=73 Ack=37 Win=501 Len=0 TSval=1180962430 TSecr=1039162777
  152 2.093100499 128.105.145.228 → 128.105.145.227 TCP 1514 45566 → 6808 [ACK] Seq=1 Ack=1 Win=10016 Len=1448 TSval=1039162849 TSecr=1180960203
  153 2.093349409 128.105.145.228 → 128.105.145.227 TCP 741 45566 → 6808 [PSH, ACK] Seq=1449 Ack=1 Win=10016 Len=675 TSval=1039162849 TSecr=1180960203
  154 2.093349534 128.105.145.228 → 128.105.145.227 TCP 2189 60426 → 6816 [PSH, ACK] Seq=1 Ack=1 Win=10226 Len=2123 TSval=1039162849 TSecr=1180960203
  155 2.093367392 128.105.145.227 → 128.105.145.228 TCP 66 6808 → 45566 [ACK] Seq=1 Ack=2124 Win=10016 Len=0 TSval=1180962503 TSecr=1039162849
  156 2.093453443 128.105.145.227 → 128.105.145.228 TCP 2189 6808 → 45566 [PSH, ACK] Seq=1 Ack=2124 Win=10016 Len=2123 TSval=1180962503 TSecr=1039162849
  157 2.093456397 128.105.145.227 → 128.105.145.228 TCP 66 6816 → 60426 [ACK] Seq=1 Ack=2124 Win=10016 Len=0 TSval=1180962503 TSecr=1039162849
  158 2.093463978 128.105.145.228 → 128.105.145.227 TCP 1514 45786 → 6806 [ACK] Seq=1 Ack=1 Win=10016 Len=1448 TSval=1039162849 TSecr=1180960203
  159 2.093524993 128.105.145.227 → 128.105.145.228 TCP 2189 6816 → 60426 [PSH, ACK] Seq=1 Ack=2124 Win=10016 Len=2123 TSval=1180962503 TSecr=1039162849
  160 2.093650799 128.105.145.228 → 128.105.145.227 TCP 1514 41406 → 6814 [ACK] Seq=1 Ack=1 Win=10226 Len=1448 TSval=1039162849 TSecr=1180960203
  161 2.093711884 128.105.145.228 → 128.105.145.227 TCP 741 45786 → 6806 [PSH, ACK] Seq=1449 Ack=1 Win=10016 Len=675 TSval=1039162849 TSecr=1180960203
  162 2.093734886 128.105.145.227 → 128.105.145.228 TCP 66 6806 → 45786 [ACK] Seq=1 Ack=2124 Win=10016 Len=0 TSval=1180962503 TSecr=1039162849
  163 2.093861748 128.105.145.228 → 128.105.145.227 TCP 741 41406 → 6814 [PSH, ACK] Seq=1449 Ack=1 Win=10226 Len=675 TSval=1039162849 TSecr=1180960203
  164 2.093861076 128.105.145.227 → 128.105.145.228 TCP 2189 6806 → 45786 [PSH, ACK] Seq=1 Ack=2124 Win=10016 Len=2123 TSval=1180962503 TSecr=1039162849
  165 2.093876012 128.105.145.227 → 128.105.145.228 TCP 66 6814 → 41406 [ACK] Seq=1 Ack=2124 Win=10016 Len=0 TSval=1180962503 TSecr=1039162849
  166 2.093957420 128.105.145.227 → 128.105.145.228 TCP 2189 6814 → 41406 [PSH, ACK] Seq=1 Ack=2124 Win=10016 Len=2123 TSval=1180962504 TSecr=1039162849
  167 2.094338593 128.105.145.228 → 128.105.145.227 TCP 66 45566 → 6808 [ACK] Seq=2124 Ack=1449 Win=10016 Len=0 TSval=1039162850 TSecr=1180962503
  168 2.094338800 128.105.145.228 → 128.105.145.227 TCP 66 45566 → 6808 [ACK] Seq=2124 Ack=2124 Win=10016 Len=0 TSval=1039162850 TSecr=1180962503
  169 2.094338877 128.105.145.228 → 128.105.145.227 TCP 66 60426 → 6816 [ACK] Seq=2124 Ack=2124 Win=10218 Len=0 TSval=1039162850 TSecr=1180962503
  170 2.094356068 128.105.145.228 → 128.105.145.227 TCP 66 45786 → 6806 [ACK] Seq=2124 Ack=2124 Win=10008 Len=0 TSval=1039162850 TSecr=1180962503
  171 2.094530078 128.105.145.228 → 128.105.145.227 TCP 66 41406 → 6814 [ACK] Seq=2124 Ack=2124 Win=10218 Len=0 TSval=1039162851 TSecr=1180962504
  172 2.096476949 128.105.145.227 → 128.105.145.228 TCP 74 46730 → 9926 [SYN] Seq=0 Win=64240 Len=0 MSS=1460 SACK_PERM=1 TSval=1180962506 TSecr=0 WS=128
  173 2.096645048 128.105.145.228 → 128.105.145.227 TCP 60 9926 → 46730 [RST, ACK] Seq=1 Ack=1 Win=0 Len=0
  174 2.164542638 128.105.145.228 → 128.105.145.227 TCP 1514 58382 → 6800 [ACK] Seq=1 Ack=1 Win=501 Len=1448 TSval=1039162920 TSecr=1180957574
  175 2.164569005 128.105.145.227 → 128.105.145.228 TCP 66 6800 → 58382 [ACK] Seq=1 Ack=1449 Win=854 Len=0 TSval=1180962574 TSecr=1039162920
  176 2.164762011 128.105.145.228 → 128.105.145.227 TCP 1066 58382 → 6800 [PSH, ACK] Seq=1449 Ack=1 Win=501 Len=1000 TSval=1039162920 TSecr=1180957574
  177 2.164762151 128.105.145.228 → 128.105.145.227 TCP 1514 58382 → 6800 [ACK] Seq=2449 Ack=1 Win=501 Len=1448 TSval=1039162921 TSecr=1180957574
  178 2.164779764 128.105.145.227 → 128.105.145.228 TCP 66 6800 → 58382 [ACK] Seq=1 Ack=2449 Win=854 Len=0 TSval=1180962574 TSecr=1039162920
  179 2.164793080 128.105.145.227 → 128.105.145.228 TCP 66 6800 → 58382 [ACK] Seq=1 Ack=3897 Win=846 Len=0 TSval=1180962574 TSecr=1039162921
  180 2.164992838 128.105.145.228 → 128.105.145.227 TCP 2962 58382 → 6800 [ACK] Seq=3897 Ack=1 Win=501 Len=2896 TSval=1039162921 TSecr=1180957574
  181 2.165021115 128.105.145.227 → 128.105.145.228 TCP 66 6800 → 58382 [ACK] Seq=1 Ack=6793 Win=846 Len=0 TSval=1180962575 TSecr=1039162921
  182 2.165236095 128.105.145.228 → 128.105.145.227 TCP 2962 58382 → 6800 [PSH, ACK] Seq=6793 Ack=1 Win=501 Len=2896 TSval=1039162921 TSecr=1180957574
  183 2.165250467 128.105.145.227 → 128.105.145.228 TCP 66 6800 → 58382 [ACK] Seq=1 Ack=9689 Win=846 Len=0 TSval=1180962575 TSecr=1039162921
  184 2.165523688 128.105.145.228 → 128.105.145.227 TCP 1498 58382 → 6800 [PSH, ACK] Seq=9689 Ack=1 Win=501 Len=1432 TSval=1039162921 TSecr=1180957574
  185 2.165544619 128.105.145.227 → 128.105.145.228 TCP 66 6800 → 58382 [ACK] Seq=1 Ack=11121 Win=854 Len=0 TSval=1180962575 TSecr=1039162921
  186 2.387380717 128.105.145.229 → 128.105.145.227 TCP 1514 58484 → 6800 [ACK] Seq=1 Ack=1 Win=501 Len=1448 TSval=3586519391 TSecr=226651925
  187 2.387406450 128.105.145.227 → 128.105.145.229 TCP 66 6800 → 58484 [ACK] Seq=1 Ack=1449 Win=854 Len=0 TSval=226656925 TSecr=3586519391
  188 2.387601944 128.105.145.229 → 128.105.145.227 TCP 2218 58484 → 6800 [PSH, ACK] Seq=1449 Ack=1 Win=501 Len=2152 TSval=3586519391 TSecr=226651925
  189 2.387634216 128.105.145.227 → 128.105.145.229 TCP 66 6800 → 58484 [ACK] Seq=1 Ack=3601 Win=846 Len=0 TSval=226656925 TSecr=3586519391
  190 2.470118546 128.105.145.228 → 128.105.145.227 TCP 2189 45580 → 6808 [PSH, ACK] Seq=1 Ack=1 Win=10016 Len=2123 TSval=1039163226 TSecr=1180958180
  191 2.470243282 128.105.145.227 → 128.105.145.228 TCP 66 6808 → 45580 [ACK] Seq=1 Ack=2124 Win=10214 Len=0 TSval=1180962880 TSecr=1039163226
  192 2.470245464 128.105.145.228 → 128.105.145.227 TCP 1514 41412 → 6814 [ACK] Seq=1 Ack=1 Win=10226 Len=1448 TSval=1039163226 TSecr=1180958181
  193 2.470369285 128.105.145.227 → 128.105.145.228 TCP 2189 6808 → 45580 [PSH, ACK] Seq=1 Ack=2124 Win=10214 Len=2123 TSval=1180962880 TSecr=1039163226
  194 2.470453994 128.105.145.228 → 128.105.145.227 TCP 1514 45802 → 6806 [ACK] Seq=1 Ack=1 Win=10016 Len=1448 TSval=1039163226 TSecr=1180958180
  195 2.470522484 128.105.145.228 → 128.105.145.227 TCP 741 41412 → 6814 [PSH, ACK] Seq=1449 Ack=1 Win=10226 Len=675 TSval=1039163226 TSecr=1180958181
  196 2.470547407 128.105.145.227 → 128.105.145.228 TCP 66 6814 → 41412 [ACK] Seq=1 Ack=2124 Win=10016 Len=0 TSval=1180962880 TSecr=1039163226
  197 2.470666848 128.105.145.228 → 128.105.145.227 TCP 741 45802 → 6806 [PSH, ACK] Seq=1449 Ack=1 Win=10016 Len=675 TSval=1039163226 TSecr=1180958180
  198 2.470680985 128.105.145.227 → 128.105.145.228 TCP 66 6806 → 45802 [ACK] Seq=1 Ack=2124 Win=10016 Len=0 TSval=1180962880 TSecr=1039163226
  199 2.470684447 128.105.145.227 → 128.105.145.228 TCP 2189 6814 → 41412 [PSH, ACK] Seq=1 Ack=2124 Win=10016 Len=2123 TSval=1180962880 TSecr=1039163226
  200 2.470749522 128.105.145.228 → 128.105.145.227 TCP 2189 60440 → 6816 [PSH, ACK] Seq=1 Ack=1 Win=10226 Len=2123 TSval=1039163226 TSecr=1180958180
  201 2.470768581 128.105.145.227 → 128.105.145.228 TCP 2189 6806 → 45802 [PSH, ACK] Seq=1 Ack=2124 Win=10016 Len=2123 TSval=1180962880 TSecr=1039163226
  202 2.470846544 128.105.145.227 → 128.105.145.228 TCP 66 6816 → 60440 [ACK] Seq=1 Ack=2124 Win=10214 Len=0 TSval=1180962880 TSecr=1039163226
  203 2.470919284 128.105.145.227 → 128.105.145.228 TCP 2189 6816 → 60440 [PSH, ACK] Seq=1 Ack=2124 Win=10214 Len=2123 TSval=1180962881 TSecr=1039163226
  204 2.471325123 128.105.145.228 → 128.105.145.227 TCP 66 45580 → 6808 [ACK] Seq=2124 Ack=1449 Win=10016 Len=0 TSval=1039163227 TSecr=1180962880
  205 2.471325337 128.105.145.228 → 128.105.145.227 TCP 66 45580 → 6808 [ACK] Seq=2124 Ack=2124 Win=10016 Len=0 TSval=1039163227 TSecr=1180962880
  206 2.471341245 128.105.145.228 → 128.105.145.227 TCP 66 41412 → 6814 [ACK] Seq=2124 Ack=1449 Win=10226 Len=0 TSval=1039163227 TSecr=1180962880
  207 2.471341456 128.105.145.228 → 128.105.145.227 TCP 66 41412 → 6814 [ACK] Seq=2124 Ack=2124 Win=10226 Len=0 TSval=1039163227 TSecr=1180962880
  208 2.471348142 128.105.145.228 → 128.105.145.227 TCP 66 45802 → 6806 [ACK] Seq=2124 Ack=1449 Win=10016 Len=0 TSval=1039163227 TSecr=1180962880
  209 2.471511479 128.105.145.228 → 128.105.145.227 TCP 66 60440 → 6816 [ACK] Seq=2124 Ack=2124 Win=10218 Len=0 TSval=1039163228 TSecr=1180962881
  210 2.471558851 128.105.145.228 → 128.105.145.227 TCP 66 45802 → 6806 [ACK] Seq=2124 Ack=2124 Win=10016 Len=0 TSval=1039163228 TSecr=1180962880
  211 2.713827351 128.105.145.227 → 128.105.145.229 TCP 2189 59466 → 6814 [PSH, ACK] Seq=1 Ack=1 Win=10016 Len=2123 TSval=226657251 TSecr=3586516218
  212 2.713839140 128.105.145.227 → 128.105.145.229 TCP 2189 45558 → 6806 [PSH, ACK] Seq=1 Ack=1 Win=10226 Len=2123 TSval=226657251 TSecr=3586516218
  213 2.713846885 128.105.145.227 → 128.105.145.229 TCP 2189 37154 → 6804 [PSH, ACK] Seq=1 Ack=1 Win=10016 Len=2123 TSval=226657251 TSecr=3586516218
  214 2.713860468 128.105.145.227 → 128.105.145.228 TCP 2189 43454 → 6812 [PSH, ACK] Seq=1 Ack=1 Win=10226 Len=2123 TSval=1180963123 TSecr=1039159971
  215 2.713868662 128.105.145.227 → 128.105.145.229 TCP 2189 42978 → 6812 [PSH, ACK] Seq=1 Ack=1 Win=10226 Len=2123 TSval=226657251 TSecr=3586516219
  216 2.713871158 128.105.145.227 → 128.105.145.228 TCP 2189 53048 → 6804 [PSH, ACK] Seq=1 Ack=1 Win=10235 Len=2123 TSval=1180963123 TSecr=1039159971
  217 2.713895350 128.105.145.227 → 128.105.145.228 TCP 2189 34040 → 6806 [PSH, ACK] Seq=1 Ack=1 Win=10016 Len=2123 TSval=1180963123 TSecr=1039159971
  218 2.713896793 128.105.145.227 → 128.105.145.228 TCP 2189 33804 → 6814 [PSH, ACK] Seq=1 Ack=1 Win=10226 Len=2123 TSval=1180963123 TSecr=1039159971
  219 2.714487368 128.105.145.229 → 128.105.145.227 TCP 66 6814 → 59466 [ACK] Seq=1 Ack=2124 Win=10016 Len=0 TSval=3586519718 TSecr=226657251
  220 2.714848595 128.105.145.229 → 128.105.145.227 TCP 1514 6814 → 59466 [ACK] Seq=1 Ack=2124 Win=10016 Len=1448 TSval=3586519718 TSecr=226657251
  221 2.714871788 128.105.145.227 → 128.105.145.229 TCP 66 59466 → 6814 [ACK] Seq=2124 Ack=1449 Win=10016 Len=0 TSval=226657252 TSecr=3586519718
  222 2.714883142 128.105.145.229 → 128.105.145.227 TCP 66 6804 → 37154 [ACK] Seq=1 Ack=2124 Win=10214 Len=0 TSval=3586519718 TSecr=226657251
  223 2.714904434 128.105.145.229 → 128.105.145.227 TCP 66 6806 → 45558 [ACK] Seq=1 Ack=2124 Win=10016 Len=0 TSval=3586519718 TSecr=226657251
  224 2.715047692 128.105.145.229 → 128.105.145.227 TCP 741 6814 → 59466 [PSH, ACK] Seq=1449 Ack=2124 Win=10016 Len=675 TSval=3586519718 TSecr=226657251
  225 2.715058642 128.105.145.227 → 128.105.145.229 TCP 66 59466 → 6814 [ACK] Seq=2124 Ack=2124 Win=10016 Len=0 TSval=226657253 TSecr=3586519718
  226 2.715118297 128.105.145.229 → 128.105.145.227 TCP 2189 6806 → 45558 [PSH, ACK] Seq=1 Ack=2124 Win=10016 Len=2123 TSval=3586519718 TSecr=226657251
  227 2.715137684 128.105.145.227 → 128.105.145.229 TCP 66 45558 → 6806 [ACK] Seq=2124 Ack=2124 Win=10218 Len=0 TSval=226657253 TSecr=3586519718
  228 2.715193269 128.105.145.229 → 128.105.145.227 TCP 1514 6804 → 37154 [ACK] Seq=1 Ack=2124 Win=10214 Len=1448 TSval=3586519718 TSecr=226657251
  229 2.715205158 128.105.145.227 → 128.105.145.229 TCP 66 37154 → 6804 [ACK] Seq=2124 Ack=1449 Win=10016 Len=0 TSval=226657253 TSecr=3586519718
  230 2.715265060 128.105.145.229 → 128.105.145.227 TCP 66 6812 → 42978 [ACK] Seq=1 Ack=2124 Win=10016 Len=0 TSval=3586519719 TSecr=226657251
  231 2.715293018 128.105.145.228 → 128.105.145.227 TCP 66 6812 → 43454 [ACK] Seq=1 Ack=2124 Win=10016 Len=0 TSval=1039163471 TSecr=1180963123
  232 2.715438397 128.105.145.229 → 128.105.145.227 TCP 741 6804 → 37154 [PSH, ACK] Seq=1449 Ack=2124 Win=10214 Len=675 TSval=3586519718 TSecr=226657251
  233 2.715447890 128.105.145.227 → 128.105.145.229 TCP 66 37154 → 6804 [ACK] Seq=2124 Ack=2124 Win=10016 Len=0 TSval=226657253 TSecr=3586519718
  234 2.715484155 128.105.145.228 → 128.105.145.227 TCP 66 6804 → 53048 [ACK] Seq=1 Ack=2124 Win=10016 Len=0 TSval=1039163471 TSecr=1180963123
  235 2.715540332 128.105.145.228 → 128.105.145.227 TCP 2189 6812 → 43454 [PSH, ACK] Seq=1 Ack=2124 Win=10016 Len=2123 TSval=1039163471 TSecr=1180963123
  236 2.715554747 128.105.145.227 → 128.105.145.228 TCP 66 43454 → 6812 [ACK] Seq=2124 Ack=2124 Win=10218 Len=0 TSval=1180963125 TSecr=1039163471
  237 2.715608343 128.105.145.229 → 128.105.145.227 TCP 1514 6812 → 42978 [ACK] Seq=1 Ack=2124 Win=10016 Len=1448 TSval=3586519719 TSecr=226657251
  238 2.715631199 128.105.145.227 → 128.105.145.229 TCP 66 42978 → 6812 [ACK] Seq=2124 Ack=1449 Win=10226 Len=0 TSval=226657253 TSecr=3586519719
  239 2.715792056 128.105.145.228 → 128.105.145.227 TCP 1514 6804 → 53048 [ACK] Seq=1 Ack=2124 Win=10016 Len=1448 TSval=1039163471 TSecr=1180963123
  240 2.715815296 128.105.145.227 → 128.105.145.228 TCP 66 53048 → 6804 [ACK] Seq=2124 Ack=1449 Win=10226 Len=0 TSval=1180963125 TSecr=1039163471
  241 2.715820245 128.105.145.229 → 128.105.145.227 TCP 741 6812 → 42978 [PSH, ACK] Seq=1449 Ack=2124 Win=10016 Len=675 TSval=3586519719 TSecr=226657251
  242 2.715829407 128.105.145.227 → 128.105.145.229 TCP 66 42978 → 6812 [ACK] Seq=2124 Ack=2124 Win=10226 Len=0 TSval=226657253 TSecr=3586519719
  243 2.716005401 128.105.145.228 → 128.105.145.227 TCP 741 6804 → 53048 [PSH, ACK] Seq=1449 Ack=2124 Win=10016 Len=675 TSval=1039163471 TSecr=1180963123
  244 2.716013898 128.105.145.227 → 128.105.145.228 TCP 66 53048 → 6804 [ACK] Seq=2124 Ack=2124 Win=10226 Len=0 TSval=1180963126 TSecr=1039163471
  245 2.716045448 128.105.145.228 → 128.105.145.227 TCP 66 6806 → 34040 [ACK] Seq=1 Ack=2124 Win=10016 Len=0 TSval=1039163472 TSecr=1180963123
  246 2.716045545 128.105.145.228 → 128.105.145.227 TCP 2189 6806 → 34040 [PSH, ACK] Seq=1 Ack=2124 Win=10016 Len=2123 TSval=1039163472 TSecr=1180963123
  247 2.716069082 128.105.145.227 → 128.105.145.228 TCP 66 34040 → 6806 [ACK] Seq=2124 Ack=2124 Win=10008 Len=0 TSval=1180963126 TSecr=1039163472
  248 2.716166155 128.105.145.228 → 128.105.145.227 TCP 66 6814 → 33804 [ACK] Seq=1 Ack=2124 Win=10214 Len=0 TSval=1039163472 TSecr=1180963123
  249 2.716166355 128.105.145.228 → 128.105.145.227 TCP 1514 6814 → 33804 [ACK] Seq=1 Ack=2124 Win=10214 Len=1448 TSval=1039163472 TSecr=1180963123
  250 2.716198487 128.105.145.227 → 128.105.145.228 TCP 66 33804 → 6814 [ACK] Seq=2124 Ack=1449 Win=10226 Len=0 TSval=1180963126 TSecr=1039163472
  251 2.716374544 128.105.145.228 → 128.105.145.227 TCP 741 6814 → 33804 [PSH, ACK] Seq=1449 Ack=2124 Win=10214 Len=675 TSval=1039163472 TSecr=1180963123
  252 2.716383827 128.105.145.227 → 128.105.145.228 TCP 66 33804 → 6814 [ACK] Seq=2124 Ack=2124 Win=10226 Len=0 TSval=1180963126 TSecr=1039163472
  253 2.883911046 128.105.145.227 → 128.105.145.228 TCP 214 6804 → 58034 [PSH, ACK] Seq=825 Ack=797 Win=2358 Len=148 TSval=1180963293 TSecr=1039161117
  254 2.884138790 128.105.145.228 → 128.105.145.227 TCP 66 58034 → 6804 [ACK] Seq=797 Ack=973 Win=17301 Len=0 TSval=1039163640 TSecr=1180963293
  255 2.884380884 128.105.145.228 → 128.105.145.227 TCP 110 58034 → 6804 [PSH, ACK] Seq=797 Ack=973 Win=17301 Len=44 TSval=1039163640 TSecr=1180963293
  256 2.884381098 128.105.145.228 → 128.105.145.227 TCP 198 58034 → 6804 [PSH, ACK] Seq=841 Ack=973 Win=17301 Len=132 TSval=1039163640 TSecr=1180963293
  257 2.884483306 128.105.145.227 → 128.105.145.228 TCP 66 6804 → 58034 [ACK] Seq=973 Ack=973 Win=2358 Len=0 TSval=1180963294 TSecr=1039163640
  258 2.884568613 128.105.145.227 → 128.105.145.228 TCP 110 6804 → 58034 [PSH, ACK] Seq=973 Ack=973 Win=2358 Len=44 TSval=1180963294 TSecr=1039163640
  259 2.926449946 128.105.145.228 → 128.105.145.227 TCP 66 58034 → 6804 [ACK] Seq=973 Ack=1017 Win=17301 Len=0 TSval=1039163683 TSecr=1180963294
  260 2.968864322 128.105.145.229 → 128.105.145.227 TCP 1514 49024 → 6808 [ACK] Seq=1 Ack=1 Win=10226 Len=1448 TSval=3586519972 TSecr=226651607
  261 2.969025367 128.105.145.229 → 128.105.145.227 TCP 1514 58722 → 6806 [ACK] Seq=1 Ack=1 Win=10016 Len=1448 TSval=3586519972 TSecr=226651607
  262 2.969074636 128.105.145.229 → 128.105.145.227 TCP 741 49024 → 6808 [PSH, ACK] Seq=1449 Ack=1 Win=10226 Len=675 TSval=3586519972 TSecr=226651607
  263 2.969090762 128.105.145.227 → 128.105.145.229 TCP 66 6808 → 49024 [ACK] Seq=1 Ack=2124 Win=10016 Len=0 TSval=226657507 TSecr=3586519972
  264 2.969245053 128.105.145.227 → 128.105.145.229 TCP 2189 6808 → 49024 [PSH, ACK] Seq=1 Ack=2124 Win=10016 Len=2123 TSval=226657507 TSecr=3586519972
  265 2.969269750 128.105.145.229 → 128.105.145.227 TCP 741 58722 → 6806 [PSH, ACK] Seq=1449 Ack=1 Win=10016 Len=675 TSval=3586519972 TSecr=226651607
  266 2.969269944 128.105.145.229 → 128.105.145.227 TCP 2189 42208 → 6814 [PSH, ACK] Seq=1 Ack=1 Win=10226 Len=2123 TSval=3586519972 TSecr=226651607
  267 2.969291934 128.105.145.227 → 128.105.145.229 TCP 66 6806 → 58722 [ACK] Seq=1 Ack=2124 Win=10214 Len=0 TSval=226657507 TSecr=3586519972
  268 2.969357456 128.105.145.227 → 128.105.145.229 TCP 66 6814 → 42208 [ACK] Seq=1 Ack=2124 Win=10214 Len=0 TSval=226657507 TSecr=3586519972
  269 2.969385391 128.105.145.227 → 128.105.145.229 TCP 2189 6806 → 58722 [PSH, ACK] Seq=1 Ack=2124 Win=10214 Len=2123 TSval=226657507 TSecr=3586519972
  270 2.969423711 128.105.145.227 → 128.105.145.229 TCP 2189 6814 → 42208 [PSH, ACK] Seq=1 Ack=2124 Win=10214 Len=2123 TSval=226657507 TSecr=3586519972
  271 2.969514525 128.105.145.229 → 128.105.145.227 TCP 2189 41390 → 6816 [PSH, ACK] Seq=1 Ack=1 Win=10016 Len=2123 TSval=3586519972 TSecr=226651607
  272 2.969608413 128.105.145.227 → 128.105.145.229 TCP 66 6816 → 41390 [ACK] Seq=1 Ack=2124 Win=10214 Len=0 TSval=226657507 TSecr=3586519972
  273 2.969674116 128.105.145.227 → 128.105.145.229 TCP 2189 6816 → 41390 [PSH, ACK] Seq=1 Ack=2124 Win=10214 Len=2123 TSval=226657507 TSecr=3586519972
  274 2.970112808 128.105.145.229 → 128.105.145.227 TCP 66 58722 → 6806 [ACK] Seq=2124 Ack=2124 Win=10008 Len=0 TSval=3586519974 TSecr=226657507
  275 2.970116974 128.105.145.229 → 128.105.145.227 TCP 66 49024 → 6808 [ACK] Seq=2124 Ack=1449 Win=10226 Len=0 TSval=3586519973 TSecr=226657507
  276 2.970117172 128.105.145.229 → 128.105.145.227 TCP 66 49024 → 6808 [ACK] Seq=2124 Ack=2124 Win=10226 Len=0 TSval=3586519973 TSecr=226657507
  277 2.970328906 128.105.145.229 → 128.105.145.227 TCP 66 42208 → 6814 [ACK] Seq=2124 Ack=2124 Win=10218 Len=0 TSval=3586519974 TSecr=226657507
  278 2.970329140 128.105.145.229 → 128.105.145.227 TCP 66 41390 → 6816 [ACK] Seq=2124 Ack=2124 Win=10008 Len=0 TSval=3586519974 TSecr=226657507
  279 3.069911027 128.105.145.227 → 128.105.145.228 SSH 102 Client: Encrypted packet (len=36)
  280 3.070633973 128.105.145.227 → 128.105.145.228 SSH 102 Client: Encrypted packet (len=36)
  281 3.070806586 128.105.145.228 → 128.105.145.227 TCP 66 22 → 56846 [ACK] Seq=1 Ack=73 Win=501 Len=0 TSval=1039163827 TSecr=1180963479
  282 3.071048861 128.105.145.228 → 128.105.145.227 SSH 102 Server: Encrypted packet (len=36)
  283 3.071065347 128.105.145.227 → 128.105.145.228 TCP 66 56846 → 22 [ACK] Seq=73 Ack=37 Win=501 Len=0 TSval=1180963481 TSecr=1039163827
  284 3.152813636 128.105.145.227 → 128.105.145.229 TCP 2189 37158 → 6804 [PSH, ACK] Seq=2124 Ack=2124 Win=10226 Len=2123 TSval=226657690 TSecr=3586518457
  285 3.152814400 128.105.145.227 → 128.105.145.228 TCP 2189 34052 → 6806 [PSH, ACK] Seq=2124 Ack=2124 Win=10226 Len=2123 TSval=1180963562 TSecr=1039162210
  286 3.152830571 128.105.145.227 → 128.105.145.229 TCP 2189 45564 → 6806 [PSH, ACK] Seq=2124 Ack=2124 Win=10016 Len=2123 TSval=226657690 TSecr=3586518457
  287 3.152839964 128.105.145.227 → 128.105.145.229 TCP 2189 34196 → 6812 [PSH, ACK] Seq=2124 Ack=2124 Win=10226 Len=2123 TSval=226657690 TSecr=3586518457
  288 3.152848375 128.105.145.227 → 128.105.145.228 TCP 2189 33818 → 6814 [PSH, ACK] Seq=2124 Ack=2124 Win=10226 Len=2123 TSval=1180963562 TSecr=1039162210
  289 3.152871069 128.105.145.227 → 128.105.145.229 TCP 2189 59512 → 6814 [PSH, ACK] Seq=2124 Ack=2124 Win=10226 Len=2123 TSval=226657690 TSecr=3586518457
  290 3.152894266 128.105.145.227 → 128.105.145.228 TCP 2189 53064 → 6804 [PSH, ACK] Seq=2124 Ack=2124 Win=10226 Len=2123 TSval=1180963562 TSecr=1039162210
