    1 0.000000000 128.105.145.227 → 128.105.145.228 SSH 102 Client: Encrypted packet (len=36)
    2 0.000745875 128.105.145.227 → 128.105.145.228 SSH 102 Client: Encrypted packet (len=36)
    3 0.001008432 128.105.145.228 → 128.105.145.227 TCP 66 22 → 56882 [ACK] Seq=1 Ack=73 Win=1406 Len=0 TSval=1091037902 TSecr=1232837555
    4 0.001008643 128.105.145.228 → 128.105.145.227 SSH 94 Server: Encrypted packet (len=28)
    5 0.001044560 128.105.145.227 → 128.105.145.228 TCP 66 56882 → 22 [ACK] Seq=73 Ack=29 Win=501 Len=0 TSval=1232837556 TSecr=1091037902
    6 0.212149130 128.105.145.228 → 128.105.145.227 TCP 1514 58358 → 6800 [ACK] Seq=1 Ack=1 Win=501 Len=1448 TSval=1091038113 TSecr=1232832767
    7 0.212177849 128.105.145.227 → 128.105.145.228 TCP 66 6800 → 58358 [ACK] Seq=1 Ack=1449 Win=586 Len=0 TSval=1232837767 TSecr=1091038113
    8 0.212367116 128.105.145.228 → 128.105.145.227 TCP 1066 58358 → 6800 [PSH, ACK] Seq=1449 Ack=1 Win=501 Len=1000 TSval=1091038113 TSecr=1232832767
    9 0.212367333 128.105.145.228 → 128.105.145.227 TCP 1514 58358 → 6800 [ACK] Seq=2449 Ack=1 Win=501 Len=1448 TSval=1091038113 TSecr=1232832767
   10 0.212393122 128.105.145.227 → 128.105.145.228 TCP 66 6800 → 58358 [ACK] Seq=1 Ack=2449 Win=586 Len=0 TSval=1232837767 TSecr=1091038113
   11 0.212411423 128.105.145.227 → 128.105.145.228 TCP 66 6800 → 58358 [ACK] Seq=1 Ack=3897 Win=578 Len=0 TSval=1232837767 TSecr=1091038113
   12 0.212613290 128.105.145.228 → 128.105.145.227 TCP 2962 58358 → 6800 [ACK] Seq=3897 Ack=1 Win=501 Len=2896 TSval=1091038113 TSecr=1232832767
   13 0.212638181 128.105.145.227 → 128.105.145.228 TCP 66 6800 → 58358 [ACK] Seq=1 Ack=6793 Win=578 Len=0 TSval=1232837767 TSecr=1091038113
   14 0.212824801 128.105.145.228 → 128.105.145.227 TCP 1466 58358 → 6800 [PSH, ACK] Seq=6793 Ack=1 Win=501 Len=1400 TSval=1091038113 TSecr=1232832767
   15 0.212835854 128.105.145.227 → 128.105.145.228 TCP 66 6800 → 58358 [ACK] Seq=1 Ack=8193 Win=586 Len=0 TSval=1232837768 TSecr=1091038113
   16 0.479830201 128.105.145.228 → 128.105.145.227 TCP 162 44698 → 3300 [PSH, ACK] Seq=1 Ack=1 Win=2952 Len=96 TSval=1091038381 TSecr=1232828033
   17 0.479875060 128.105.145.227 → 128.105.145.228 TCP 66 3300 → 44698 [ACK] Seq=1 Ack=97 Win=3374 Len=0 TSval=1232838035 TSecr=1091038381
   18 0.479962091 128.105.145.227 → 128.105.145.228 TCP 162 3300 → 44698 [PSH, ACK] Seq=1 Ack=97 Win=3374 Len=96 TSval=1232838035 TSecr=1091038381
   19 0.480275736 128.105.145.228 → 128.105.145.227 TCP 66 44698 → 3300 [ACK] Seq=97 Ack=97 Win=2952 Len=0 TSval=1091038382 TSecr=1232838035
   20 0.715562561 128.105.145.227 → 128.105.145.228 TCP 2189 34052 → 6806 [PSH, ACK] Seq=1 Ack=1 Win=10226 Len=2123 TSval=1232838270 TSecr=1091035118
   21 0.715587588 128.105.145.227 → 128.105.145.228 TCP 2189 33818 → 6814 [PSH, ACK] Seq=1 Ack=1 Win=10226 Len=2123 TSval=1232838270 TSecr=1091035118
   22 0.715647370 128.105.145.227 → 128.105.145.228 TCP 2189 53064 → 6804 [PSH, ACK] Seq=1 Ack=1 Win=10226 Len=2123 TSval=1232838270 TSecr=1091035118
   23 0.715683264 128.105.145.227 → 128.105.145.228 TCP 2189 43468 → 6812 [PSH, ACK] Seq=1 Ack=1 Win=10226 Len=2123 TSval=1232838270 TSecr=1091035119
   24 0.716189263 128.105.145.228 → 128.105.145.227 TCP 66 6806 → 34052 [ACK] Seq=1 Ack=2124 Win=10016 Len=0 TSval=1091038618 TSecr=1232838270
   25 0.716502443 128.105.145.228 → 128.105.145.227 TCP 1514 6806 → 34052 [ACK] Seq=1 Ack=2124 Win=10016 Len=1448 TSval=1091038618 TSecr=1232838270
   26 0.716524661 128.105.145.227 → 128.105.145.228 TCP 66 34052 → 6806 [ACK] Seq=2124 Ack=1449 Win=10226 Len=0 TSval=1232838271 TSecr=1091038618
   27 0.716546985 128.105.145.228 → 128.105.145.227 TCP 66 6814 → 33818 [ACK] Seq=1 Ack=2124 Win=10214 Len=0 TSval=1091038618 TSecr=1232838270
   28 0.716715244 128.105.145.228 → 128.105.145.227 TCP 741 6806 → 34052 [PSH, ACK] Seq=1449 Ack=2124 Win=10016 Len=675 TSval=1091038618 TSecr=1232838270
   29 0.716725034 128.105.145.227 → 128.105.145.228 TCP 66 34052 → 6806 [ACK] Seq=2124 Ack=2124 Win=10226 Len=0 TSval=1232838272 TSecr=1091038618
   30 0.716878540 128.105.145.228 → 128.105.145.227 TCP 1514 6814 → 33818 [ACK] Seq=1 Ack=2124 Win=10214 Len=1448 TSval=1091038618 TSecr=1232838270
   31 0.716901325 128.105.145.227 → 128.105.145.228 TCP 66 33818 → 6814 [ACK] Seq=2124 Ack=1449 Win=10226 Len=0 TSval=1232838272 TSecr=1091038618
   32 0.717091314 128.105.145.228 → 128.105.145.227 TCP 741 6814 → 33818 [PSH, ACK] Seq=1449 Ack=2124 Win=10214 Len=675 TSval=1091038618 TSecr=1232838270
   33 0.717099617 128.105.145.227 → 128.105.145.228 TCP 66 33818 → 6814 [ACK] Seq=2124 Ack=2124 Win=10226 Len=0 TSval=1232838272 TSecr=1091038618
   34 0.717316487 128.105.145.228 → 128.105.145.227 TCP 66 6804 → 53064 [ACK] Seq=1 Ack=2124 Win=10016 Len=0 TSval=1091038618 TSecr=1232838270
   35 0.717564800 128.105.145.228 → 128.105.145.227 TCP 2189 6804 → 53064 [PSH, ACK] Seq=1 Ack=2124 Win=10016 Len=2123 TSval=1091038618 TSecr=1232838270
   36 0.717597850 128.105.145.227 → 128.105.145.228 TCP 66 53064 → 6804 [ACK] Seq=2124 Ack=2124 Win=10218 Len=0 TSval=1232838272 TSecr=1091038618
   37 0.717688684 128.105.145.228 → 128.105.145.227 TCP 66 6812 → 43468 [ACK] Seq=1 Ack=2124 Win=10214 Len=0 TSval=1091038619 TSecr=1232838270
   38 0.717934532 128.105.145.228 → 128.105.145.227 TCP 2189 6812 → 43468 [PSH, ACK] Seq=1 Ack=2124 Win=10214 Len=2123 TSval=1091038619 TSecr=1232838270
   39 0.717958617 128.105.145.227 → 128.105.145.228 TCP 66 43468 → 6812 [ACK] Seq=2124 Ack=2124 Win=10218 Len=0 TSval=1232838273 TSecr=1091038619
   40 0.806121041 128.105.145.227 → 128.105.145.228 TCP 2189 43454 → 6812 [PSH, ACK] Seq=1 Ack=1 Win=10226 Len=2123 TSval=1232838361 TSecr=1091036408
   41 0.806136786 128.105.145.227 → 128.105.145.228 TCP 2189 53048 → 6804 [PSH, ACK] Seq=1 Ack=1 Win=10235 Len=2123 TSval=1232838361 TSecr=1091036408
   42 0.806146924 128.105.145.227 → 128.105.145.228 TCP 2189 34040 → 6806 [PSH, ACK] Seq=1 Ack=1 Win=10016 Len=2123 TSval=1232838361 TSecr=1091036409
   43 0.806156283 128.105.145.227 → 128.105.145.228 TCP 2189 33804 → 6814 [PSH, ACK] Seq=1 Ack=1 Win=10226 Len=2123 TSval=1232838361 TSecr=1091036409
   44 0.807345876 128.105.145.228 → 128.105.145.227 TCP 66 6812 → 43454 [ACK] Seq=1 Ack=2124 Win=10016 Len=0 TSval=1091038709 TSecr=1232838361
   45 0.807720840 128.105.145.228 → 128.105.145.227 TCP 66 6804 → 53048 [ACK] Seq=1 Ack=2124 Win=10016 Len=0 TSval=1091038709 TSecr=1232838361
   46 0.807811811 128.105.145.228 → 128.105.145.227 TCP 2189 6812 → 43454 [PSH, ACK] Seq=1 Ack=2124 Win=10016 Len=2123 TSval=1091038709 TSecr=1232838361
   47 0.807842478 128.105.145.227 → 128.105.145.228 TCP 66 43454 → 6812 [ACK] Seq=2124 Ack=2124 Win=10218 Len=0 TSval=1232838363 TSecr=1091038709
   48 0.808018309 128.105.145.228 → 128.105.145.227 TCP 1514 6804 → 53048 [ACK] Seq=1 Ack=2124 Win=10016 Len=1448 TSval=1091038709 TSecr=1232838361
   49 0.808032794 128.105.145.227 → 128.105.145.228 TCP 66 53048 → 6804 [ACK] Seq=2124 Ack=1449 Win=10226 Len=0 TSval=1232838363 TSecr=1091038709
   50 0.808262676 128.105.145.228 → 128.105.145.227 TCP 741 6804 → 53048 [PSH, ACK] Seq=1449 Ack=2124 Win=10016 Len=675 TSval=1091038709 TSecr=1232838361
   51 0.808270695 128.105.145.227 → 128.105.145.228 TCP 66 53048 → 6804 [ACK] Seq=2124 Ack=2124 Win=10226 Len=0 TSval=1232838363 TSecr=1091038709
   52 0.808285264 128.105.145.228 → 128.105.145.227 TCP 66 6806 → 34040 [ACK] Seq=1 Ack=2124 Win=10016 Len=0 TSval=1091038709 TSecr=1232838361
   53 0.808469150 128.105.145.228 → 128.105.145.227 TCP 66 6814 → 33804 [ACK] Seq=1 Ack=2124 Win=10214 Len=0 TSval=1091038709 TSecr=1232838361
   54 0.808567840 128.105.145.228 → 128.105.145.227 TCP 2189 6806 → 34040 [PSH, ACK] Seq=1 Ack=2124 Win=10016 Len=2123 TSval=1091038709 TSecr=1232838361
   55 0.808597519 128.105.145.227 → 128.105.145.228 TCP 66 34040 → 6806 [ACK] Seq=2124 Ack=2124 Win=10008 Len=0 TSval=1232838363 TSecr=1091038709
   56 0.808715799 128.105.145.228 → 128.105.145.227 TCP 2189 6814 → 33804 [PSH, ACK] Seq=1 Ack=2124 Win=10214 Len=2123 TSval=1091038709 TSecr=1232838361
   57 0.808731972 128.105.145.227 → 128.105.145.228 TCP 66 33804 → 6814 [ACK] Seq=2124 Ack=2124 Win=10218 Len=0 TSval=1232838364 TSecr=1091038709
   58 1.257833991 128.105.145.228 → 128.105.145.227 TCP 2189 45580 → 6808 [PSH, ACK] Seq=1 Ack=1 Win=10016 Len=2123 TSval=1091039159 TSecr=1232833513
   59 1.257954617 128.105.145.227 → 128.105.145.228 TCP 66 6808 → 45580 [ACK] Seq=1 Ack=2124 Win=10214 Len=0 TSval=1232838813 TSecr=1091039159
   60 1.257990588 128.105.145.228 → 128.105.145.227 TCP 1514 45802 → 6806 [ACK] Seq=1 Ack=1 Win=10016 Len=1448 TSval=1091039159 TSecr=1232833513
   61 1.258057089 128.105.145.227 → 128.105.145.228 TCP 2189 6808 → 45580 [PSH, ACK] Seq=1 Ack=2124 Win=10214 Len=2123 TSval=1232838813 TSecr=1091039159
   62 1.258236134 128.105.145.228 → 128.105.145.227 TCP 741 45802 → 6806 [PSH, ACK] Seq=1449 Ack=1 Win=10016 Len=675 TSval=1091039159 TSecr=1232833513
   63 1.258240431 128.105.145.228 → 128.105.145.227 TCP 2189 60440 → 6816 [PSH, ACK] Seq=1 Ack=1 Win=10226 Len=2123 TSval=1091039159 TSecr=1232833513
   64 1.258264292 128.105.145.227 → 128.105.145.228 TCP 66 6806 → 45802 [ACK] Seq=1 Ack=2124 Win=10016 Len=0 TSval=1232838813 TSecr=1091039159
   65 1.258353753 128.105.145.227 → 128.105.145.228 TCP 66 6816 → 60440 [ACK] Seq=1 Ack=2124 Win=10214 Len=0 TSval=1232838813 TSecr=1091039159
   66 1.258357168 128.105.145.228 → 128.105.145.227 TCP 1514 41412 → 6814 [ACK] Seq=1 Ack=1 Win=10226 Len=1448 TSval=1091039159 TSecr=1232833513
   67 1.258429721 128.105.145.227 → 128.105.145.228 TCP 2189 6806 → 45802 [PSH, ACK] Seq=1 Ack=2124 Win=10016 Len=2123 TSval=1232838813 TSecr=1091039159
   68 1.258443133 128.105.145.227 → 128.105.145.228 TCP 2189 6816 → 60440 [PSH, ACK] Seq=1 Ack=2124 Win=10214 Len=2123 TSval=1232838813 TSecr=1091039159
   69 1.258603827 128.105.145.228 → 128.105.145.227 TCP 741 41412 → 6814 [PSH, ACK] Seq=1449 Ack=1 Win=10226 Len=675 TSval=1091039159 TSecr=1232833513
   70 1.258626545 128.105.145.227 → 128.105.145.228 TCP 66 6814 → 41412 [ACK] Seq=1 Ack=2124 Win=10016 Len=0 TSval=1232838813 TSecr=1091039159
   71 1.258773953 128.105.145.227 → 128.105.145.228 TCP 2189 6814 → 41412 [PSH, ACK] Seq=1 Ack=2124 Win=10016 Len=2123 TSval=1232838814 TSecr=1091039159
   72 1.259768526 128.105.145.228 → 128.105.145.227 TCP 66 45802 → 6806 [ACK] Seq=2124 Ack=1449 Win=10016 Len=0 TSval=1091039160 TSecr=1232838813
   73 1.259768746 128.105.145.228 → 128.105.145.227 TCP 66 45802 → 6806 [ACK] Seq=2124 Ack=2124 Win=10016 Len=0 TSval=1091039160 TSecr=1232838813
   74 1.259781310 128.105.145.228 → 128.105.145.227 TCP 66 45580 → 6808 [ACK] Seq=2124 Ack=1449 Win=10016 Len=0 TSval=1091039160 TSecr=1232838813
   75 1.259782450 128.105.145.228 → 128.105.145.227 TCP 66 60440 → 6816 [ACK] Seq=2124 Ack=2124 Win=10218 Len=0 TSval=1091039160 TSecr=1232838813
   76 1.259781511 128.105.145.228 → 128.105.145.227 TCP 66 45580 → 6808 [ACK] Seq=2124 Ack=2124 Win=10016 Len=0 TSval=1091039160 TSecr=1232838813
   77 1.259817100 128.105.145.228 → 128.105.145.227 TCP 66 41412 → 6814 [ACK] Seq=2124 Ack=1449 Win=10226 Len=0 TSval=1091039161 TSecr=1232838814
   78 1.259817304 128.105.145.228 → 128.105.145.227 TCP 66 41412 → 6814 [ACK] Seq=2124 Ack=2124 Win=10226 Len=0 TSval=1091039161 TSecr=1232838814
   79 1.906691155 128.105.145.227 → 128.105.145.228 SSH 102 Client: Encrypted packet (len=36)
   80 1.907465934 128.105.145.227 → 128.105.145.228 SSH 102 Client: Encrypted packet (len=36)
   81 1.907664666 128.105.145.228 → 128.105.145.227 TCP 66 22 → 49604 [ACK] Seq=1 Ack=73 Win=2379 Len=0 TSval=1091039809 TSecr=1232839461
   82 1.907876120 128.105.145.228 → 128.105.145.227 SSH 102 Server: Encrypted packet (len=36)
   83 1.907890946 128.105.145.227 → 128.105.145.228 TCP 66 49604 → 22 [ACK] Seq=73 Ack=37 Win=1134 Len=0 TSval=1232839463 TSecr=1091039809
   84 2.168303518 128.105.145.227 → 128.105.145.228 SSH 102 Client: Encrypted packet (len=36)
   85 2.168753753 128.105.145.227 → 128.105.145.228 SSH 110 Client: Encrypted packet (len=44)
   86 2.169062658 128.105.145.228 → 128.105.145.227 TCP 66 22 → 56882 [ACK] Seq=29 Ack=153 Win=1406 Len=0 TSval=1091040070 TSecr=1232839723
   87 2.169062859 128.105.145.228 → 128.105.145.227 SSH 102 Server: Encrypted packet (len=36)
   88 2.169104102 128.105.145.227 → 128.105.145.228 TCP 66 56882 → 22 [ACK] Seq=153 Ack=65 Win=501 Len=0 TSval=1232839724 TSecr=1091040070
   89 2.170202584 128.105.145.227 → 128.105.145.228 SSH 102 Client: Encrypted packet (len=36)
   90 2.170617952 128.105.145.227 → 128.105.145.228 SSH 102 Client: Encrypted packet (len=36)
   91 2.170950503 128.105.145.228 → 128.105.145.227 TCP 66 22 → 56882 [ACK] Seq=65 Ack=225 Win=1406 Len=0 TSval=1091040072 TSecr=1232839725
   92 2.171702991 128.105.145.228 → 128.105.145.227 SSH 138 Server: Encrypted packet (len=72)
   93 2.171725108 128.105.145.227 → 128.105.145.228 TCP 66 56882 → 22 [ACK] Seq=225 Ack=137 Win=501 Len=0 TSval=1232839727 TSecr=1091040073
   94 2.176988759 128.105.145.228 → 128.105.145.227 SSH 174 Server: Encrypted packet (len=108)
   95 2.177020238 128.105.145.227 → 128.105.145.228 TCP 66 56882 → 22 [ACK] Seq=225 Ack=245 Win=501 Len=0 TSval=1232839732 TSecr=1091040078
   96 2.179194434 128.105.145.227 → 128.105.145.228 SSH 102 Client: Encrypted packet (len=36)
   97 2.179640200 128.105.145.227 → 128.105.145.228 SSH 102 Client: Encrypted packet (len=36)
   98 2.179939866 128.105.145.228 → 128.105.145.227 TCP 66 22 → 56882 [ACK] Seq=245 Ack=297 Win=1406 Len=0 TSval=1091040081 TSecr=1232839734
   99 2.180607229 128.105.145.227 → 128.105.145.228 SSH 102 Client: Encrypted packet (len=36)
  100 2.181066795 128.105.145.227 → 128.105.145.228 SSH 110 Client: Encrypted packet (len=44)
  101 2.181353356 128.105.145.228 → 128.105.145.227 TCP 66 22 → 56882 [ACK] Seq=245 Ack=377 Win=1406 Len=0 TSval=1091040083 TSecr=1232839735
  102 2.181353560 128.105.145.228 → 128.105.145.227 SSH 102 Server: Encrypted packet (len=36)
  103 2.181383572 128.105.145.227 → 128.105.145.228 TCP 66 56882 → 22 [ACK] Seq=377 Ack=281 Win=501 Len=0 TSval=1232839736 TSecr=1091040083
  104 2.182668582 128.105.145.227 → 128.105.145.228 SSH 102 Client: Encrypted packet (len=36)
  105 2.183115806 128.105.145.227 → 128.105.145.228 SSH 102 Client: Encrypted packet (len=36)
  106 2.183419808 128.105.145.228 → 128.105.145.227 TCP 66 22 → 56882 [ACK] Seq=281 Ack=449 Win=1406 Len=0 TSval=1091040085 TSecr=1232839737
  107 2.183980847 128.105.145.228 → 128.105.145.227 SSH 138 Server: Encrypted packet (len=72)
  108 2.184004565 128.105.145.227 → 128.105.145.228 TCP 66 56882 → 22 [ACK] Seq=449 Ack=353 Win=501 Len=0 TSval=1232839739 TSecr=1091040085
  109 2.189675451 128.105.145.228 → 128.105.145.227 SSH 118 Server: Encrypted packet (len=52)
  110 2.189709023 128.105.145.227 → 128.105.145.228 TCP 66 56882 → 22 [ACK] Seq=449 Ack=405 Win=501 Len=0 TSval=1232839745 TSecr=1091040091
  111 2.189893481 128.105.145.228 → 128.105.145.227 SSH 174 Server: Encrypted packet (len=108)
  112 2.189901009 128.105.145.227 → 128.105.145.228 TCP 66 56882 → 22 [ACK] Seq=449 Ack=513 Win=501 Len=0 TSval=1232839745 TSecr=1091040091
  113 2.192510495 128.105.145.227 → 128.105.145.228 SSH 102 Client: Encrypted packet (len=36)
  114 2.192974021 128.105.145.227 → 128.105.145.228 SSH 102 Client: Encrypted packet (len=36)
  115 2.193258934 128.105.145.228 → 128.105.145.227 TCP 66 22 → 56882 [ACK] Seq=513 Ack=521 Win=1406 Len=0 TSval=1091040094 TSecr=1232839747
  116 2.193994990 128.105.145.227 → 128.105.145.228 SSH 102 Client: Encrypted packet (len=36)
  117 2.194471878 128.105.145.227 → 128.105.145.228 SSH 110 Client: Encrypted packet (len=44)
  118 2.194749096 128.105.145.228 → 128.105.145.227 TCP 66 22 → 56882 [ACK] Seq=513 Ack=601 Win=1406 Len=0 TSval=1091040096 TSecr=1232839749
  119 2.194749307 128.105.145.228 → 128.105.145.227 SSH 102 Server: Encrypted packet (len=36)
  120 2.194778762 128.105.145.227 → 128.105.145.228 TCP 66 56882 → 22 [ACK] Seq=601 Ack=549 Win=501 Len=0 TSval=1232839750 TSecr=1091040096
  121 2.195976152 128.105.145.227 → 128.105.145.228 SSH 102 Client: Encrypted packet (len=36)
  122 2.196443943 128.105.145.227 → 128.105.145.228 SSH 102 Client: Encrypted packet (len=36)
  123 2.196724354 128.105.145.228 → 128.105.145.227 TCP 66 22 → 56882 [ACK] Seq=549 Ack=673 Win=1406 Len=0 TSval=1091040098 TSecr=1232839751
  124 2.197366253 128.105.145.228 → 128.105.145.227 SSH 138 Server: Encrypted packet (len=72)
  125 2.197389987 128.105.145.227 → 128.105.145.228 TCP 66 56882 → 22 [ACK] Seq=673 Ack=621 Win=501 Len=0 TSval=1232839752 TSecr=1091040099
  126 2.201914994 128.105.145.228 → 128.105.145.227 SSH 174 Server: Encrypted packet (len=108)
  127 2.201937091 128.105.145.227 → 128.105.145.228 TCP 66 56882 → 22 [ACK] Seq=673 Ack=729 Win=501 Len=0 TSval=1232839757 TSecr=1091040103
  128 2.205007434 128.105.145.227 → 128.105.145.228 SSH 102 Client: Encrypted packet (len=36)
  129 2.205426166 128.105.145.227 → 128.105.145.228 SSH 102 Client: Encrypted packet (len=36)
  130 2.205742099 128.105.145.228 → 128.105.145.227 TCP 1398 6810 → 60044 [PSH, ACK] Seq=1 Ack=1 Win=10402 Len=1332 TSval=1091040107 TSecr=1232836365
  131 2.205760166 128.105.145.228 → 128.105.145.227 TCP 66 22 → 56882 [ACK] Seq=729 Ack=745 Win=1406 Len=0 TSval=1091040107 TSecr=1232839760
  132 2.205779334 128.105.145.227 → 128.105.145.228 TCP 66 60044 → 6810 [ACK] Seq=1 Ack=1333 Win=10051 Len=0 TSval=1232839761 TSecr=1091040107
  133 2.205985735 128.105.145.228 → 128.105.145.227 TCP 806 6810 → 60044 [PSH, ACK] Seq=1333 Ack=1 Win=10402 Len=740 TSval=1091040107 TSecr=1232836365
  134 2.206001829 128.105.145.227 → 128.105.145.228 TCP 66 60044 → 6810 [ACK] Seq=1 Ack=2073 Win=10051 Len=0 TSval=1232839761 TSecr=1091040107
  135 2.206230328 128.105.145.228 → 128.105.145.227 TCP 954 6810 → 60044 [PSH, ACK] Seq=2073 Ack=1 Win=10402 Len=888 TSval=1091040107 TSecr=1232836365
  136 2.206230481 128.105.145.228 → 128.105.145.227 TCP 658 6810 → 60044 [PSH, ACK] Seq=2961 Ack=1 Win=10402 Len=592 TSval=1091040107 TSecr=1232836365
  137 2.206247224 128.105.145.227 → 128.105.145.228 TCP 66 60044 → 6810 [ACK] Seq=1 Ack=2961 Win=10051 Len=0 TSval=1232839761 TSecr=1091040107
  138 2.206276941 128.105.145.227 → 128.105.145.228 TCP 198 60044 → 6810 [ACK] Seq=1 Ack=3553 Win=10047 Len=132 TSval=1232839761 TSecr=1091040107
  139 2.206339912 128.105.145.227 → 128.105.145.228 SSH 102 Client: Encrypted packet (len=36)
  140 2.206362723 128.105.145.227 → 128.105.145.228 TCP 1514 60044 → 6810 [ACK] Seq=133 Ack=3553 Win=10051 Len=1448 TSval=1232839761 TSecr=1091040107
  141 2.206479456 128.105.145.228 → 128.105.145.227 TCP 658 6810 → 60044 [PSH, ACK] Seq=3553 Ack=1 Win=10402 Len=592 TSval=1091040107 TSecr=1232839761
  142 2.206479568 128.105.145.228 → 128.105.145.227 TCP 510 6810 → 60044 [PSH, ACK] Seq=4145 Ack=1 Win=10402 Len=444 TSval=1091040107 TSecr=1232839761
  143 2.206479625 128.105.145.228 → 128.105.145.227 TCP 214 6810 → 60044 [PSH, ACK] Seq=4589 Ack=1 Win=10402 Len=148 TSval=1091040107 TSecr=1232839761
  144 2.206498609 128.105.145.227 → 128.105.145.228 TCP 66 60044 → 6810 [ACK] Seq=1581 Ack=4145 Win=10051 Len=0 TSval=1232839761 TSecr=1091040107
  145 2.206509581 128.105.145.227 → 128.105.145.228 TCP 334 60044 → 6810 [PSH, ACK] Seq=1581 Ack=4589 Win=10051 Len=268 TSval=1232839761 TSecr=1091040107
  146 2.206519300 128.105.145.227 → 128.105.145.228 TCP 66 60044 → 6810 [ACK] Seq=1849 Ack=4737 Win=10051 Len=0 TSval=1232839761 TSecr=1091040107
  147 2.206798979 128.105.145.227 → 128.105.145.228 SSH 110 Client: Encrypted packet (len=44)
  148 2.206886384 128.105.145.227 → 128.105.145.228 TCP 1514 60044 → 6810 [ACK] Seq=1849 Ack=4737 Win=10051 Len=1448 TSval=1232839762 TSecr=1091040107
  149 2.206965159 128.105.145.228 → 128.105.145.227 TCP 110 6810 → 60044 [PSH, ACK] Seq=4737 Ack=133 Win=10402 Len=44 TSval=1091040108 TSecr=1232839761
  150 2.206965251 128.105.145.228 → 128.105.145.227 TCP 66 6810 → 60044 [ACK] Seq=4781 Ack=1849 Win=10425 Len=0 TSval=1091040108 TSecr=1232839761
  151 2.206987620 128.105.145.227 → 128.105.145.228 TCP 994 60044 → 6810 [PSH, ACK] Seq=3297 Ack=4781 Win=10051 Len=928 TSval=1232839762 TSecr=1091040108
  152 2.207132863 128.105.145.228 → 128.105.145.227 TCP 66 22 → 56882 [ACK] Seq=729 Ack=825 Win=1406 Len=0 TSval=1091040108 TSecr=1232839761
  153 2.207383919 128.105.145.228 → 128.105.145.227 SSH 102 Server: Encrypted packet (len=36)
  154 2.207454036 128.105.145.228 → 128.105.145.227 TCP 110 6810 → 60044 [PSH, ACK] Seq=4781 Ack=1849 Win=10425 Len=44 TSval=1091040109 TSecr=1232839761
  155 2.207472104 128.105.145.227 → 128.105.145.228 TCP 66 60044 → 6810 [ACK] Seq=4225 Ack=4825 Win=10051 Len=0 TSval=1232839762 TSecr=1091040109
  156 2.207726612 128.105.145.228 → 128.105.145.227 TCP 66 6810 → 60044 [ACK] Seq=4825 Ack=4225 Win=10470 Len=0 TSval=1091040109 TSecr=1232839762
  157 2.207944835 128.105.145.228 → 128.105.145.227 TCP 110 6810 → 60044 [PSH, ACK] Seq=4825 Ack=4225 Win=10470 Len=44 TSval=1091040109 TSecr=1232839762
  158 2.207959322 128.105.145.227 → 128.105.145.228 TCP 66 60044 → 6810 [ACK] Seq=4225 Ack=4869 Win=10051 Len=0 TSval=1232839763 TSecr=1091040109
  159 2.208675060 128.105.145.227 → 128.105.145.228 SSH 102 Client: Encrypted packet (len=36)
  160 2.209117639 128.105.145.227 → 128.105.145.228 SSH 118 Client: Encrypted packet (len=52)
  161 2.209428108 128.105.145.228 → 128.105.145.227 TCP 66 22 → 56882 [ACK] Seq=765 Ack=913 Win=1406 Len=0 TSval=1091040111 TSecr=1232839763
  162 2.209926665 128.105.145.228 → 128.105.145.227 SSH 138 Server: Encrypted packet (len=72)
  163 2.251752116 128.105.145.227 → 128.105.145.228 TCP 66 56882 → 22 [ACK] Seq=913 Ack=837 Win=501 Len=0 TSval=1232839807 TSecr=1091040111
  164 2.358193164 128.105.145.228 → 128.105.145.227 TCP 1514 45580 → 6808 [ACK] Seq=2124 Ack=2124 Win=10016 Len=1448 TSval=1091040259 TSecr=1232838813
  165 2.358291814 128.105.145.228 → 128.105.145.227 TCP 1514 45802 → 6806 [ACK] Seq=2124 Ack=2124 Win=10016 Len=1448 TSval=1091040259 TSecr=1232838813
  166 2.358411611 128.105.145.228 → 128.105.145.227 TCP 741 45580 → 6808 [PSH, ACK] Seq=3572 Ack=2124 Win=10016 Len=675 TSval=1091040259 TSecr=1232838813
  167 2.358434487 128.105.145.227 → 128.105.145.228 TCP 66 6808 → 45580 [ACK] Seq=2124 Ack=4247 Win=10214 Len=0 TSval=1232839913 TSecr=1091040259
  168 2.358507842 128.105.145.228 → 128.105.145.227 TCP 741 45802 → 6806 [PSH, ACK] Seq=3572 Ack=2124 Win=10016 Len=675 TSval=1091040259 TSecr=1232838813
  169 2.358530761 128.105.145.227 → 128.105.145.228 TCP 66 6806 → 45802 [ACK] Seq=2124 Ack=4247 Win=10016 Len=0 TSval=1232839913 TSecr=1091040259
  170 2.358583876 128.105.145.227 → 128.105.145.228 TCP 2189 6808 → 45580 [PSH, ACK] Seq=2124 Ack=4247 Win=10214 Len=2123 TSval=1232839913 TSecr=1091040259
  171 2.358676598 128.105.145.227 → 128.105.145.228 TCP 2189 6806 → 45802 [PSH, ACK] Seq=2124 Ack=4247 Win=10016 Len=2123 TSval=1232839913 TSecr=1091040259
  172 2.358727592 128.105.145.228 → 128.105.145.227 TCP 2189 60440 → 6816 [PSH, ACK] Seq=2124 Ack=2124 Win=10226 Len=2123 TSval=1091040259 TSecr=1232838813
  173 2.358828892 128.105.145.227 → 128.105.145.228 TCP 66 6816 → 60440 [ACK] Seq=2124 Ack=4247 Win=10214 Len=0 TSval=1232839914 TSecr=1091040259
  174 2.358901491 128.105.145.227 → 128.105.145.228 TCP 2189 6816 → 60440 [PSH, ACK] Seq=2124 Ack=4247 Win=10214 Len=2123 TSval=1232839914 TSecr=1091040259
  175 2.358911569 128.105.145.228 → 128.105.145.227 TCP 1514 41412 → 6814 [ACK] Seq=2124 Ack=2124 Win=10226 Len=1448 TSval=1091040259 TSecr=1232838814
  176 2.359116868 128.105.145.228 → 128.105.145.227 TCP 741 41412 → 6814 [PSH, ACK] Seq=3572 Ack=2124 Win=10226 Len=675 TSval=1091040259 TSecr=1232838814
  177 2.359129819 128.105.145.227 → 128.105.145.228 TCP 66 6814 → 41412 [ACK] Seq=2124 Ack=4247 Win=10016 Len=0 TSval=1232839914 TSecr=1091040259
  178 2.359217833 128.105.145.227 → 128.105.145.228 TCP 2189 6814 → 41412 [PSH, ACK] Seq=2124 Ack=4247 Win=10016 Len=2123 TSval=1232839914 TSecr=1091040259
  179 2.360159557 128.105.145.228 → 128.105.145.227 TCP 66 45580 → 6808 [ACK] Seq=4247 Ack=3572 Win=10016 Len=0 TSval=1091040260 TSecr=1232839913
  180 2.360160262 128.105.145.228 → 128.105.145.227 TCP 66 60440 → 6816 [ACK] Seq=4247 Ack=4247 Win=10218 Len=0 TSval=1091040261 TSecr=1232839914
  181 2.360161371 128.105.145.228 → 128.105.145.227 TCP 66 45802 → 6806 [ACK] Seq=4247 Ack=3572 Win=10016 Len=0 TSval=1091040260 TSecr=1232839913
  182 2.360159764 128.105.145.228 → 128.105.145.227 TCP 66 45580 → 6808 [ACK] Seq=4247 Ack=4247 Win=10016 Len=0 TSval=1091040261 TSecr=1232839913
  183 2.360161548 128.105.145.228 → 128.105.145.227 TCP 66 45802 → 6806 [ACK] Seq=4247 Ack=4247 Win=10016 Len=0 TSval=1091040261 TSecr=1232839913
  184 2.360190599 128.105.145.228 → 128.105.145.227 TCP 66 41412 → 6814 [ACK] Seq=4247 Ack=3572 Win=10226 Len=0 TSval=1091040261 TSecr=1232839914
  185 2.360190803 128.105.145.228 → 128.105.145.227 TCP 66 41412 → 6814 [ACK] Seq=4247 Ack=4247 Win=10226 Len=0 TSval=1091040261 TSecr=1232839914
  186 2.778744675 128.105.145.228 → 128.105.145.227 TCP 1514 45786 → 6806 [ACK] Seq=1 Ack=1 Win=10016 Len=1448 TSval=1091040680 TSecr=1232836834
  187 2.778918433 128.105.145.228 → 128.105.145.227 TCP 1514 45566 → 6808 [ACK] Seq=1 Ack=1 Win=10016 Len=1448 TSval=1091040680 TSecr=1232836833
  188 2.778979996 128.105.145.228 → 128.105.145.227 TCP 741 45786 → 6806 [PSH, ACK] Seq=1449 Ack=1 Win=10016 Len=675 TSval=1091040680 TSecr=1232836834
  189 2.779003383 128.105.145.227 → 128.105.145.228 TCP 66 6806 → 45786 [ACK] Seq=1 Ack=2124 Win=10016 Len=0 TSval=1232840334 TSecr=1091040680
  190 2.779093034 128.105.145.227 → 128.105.145.228 TCP 2189 6806 → 45786 [PSH, ACK] Seq=1 Ack=2124 Win=10016 Len=2123 TSval=1232840334 TSecr=1091040680
  191 2.779165403 128.105.145.228 → 128.105.145.227 TCP 741 45566 → 6808 [PSH, ACK] Seq=1449 Ack=1 Win=10016 Len=675 TSval=1091040680 TSecr=1232836833
  192 2.779165617 128.105.145.228 → 128.105.145.227 TCP 2189 60426 → 6816 [PSH, ACK] Seq=1 Ack=1 Win=10226 Len=2123 TSval=1091040680 TSecr=1232836834
  193 2.779191831 128.105.145.227 → 128.105.145.228 TCP 66 6808 → 45566 [ACK] Seq=1 Ack=2124 Win=10016 Len=0 TSval=1232840334 TSecr=1091040680
  194 2.779309944 128.105.145.227 → 128.105.145.228 TCP 66 6816 → 60426 [ACK] Seq=1 Ack=2124 Win=10016 Len=0 TSval=1232840334 TSecr=1091040680
  195 2.779331617 128.105.145.227 → 128.105.145.228 TCP 2189 6808 → 45566 [PSH, ACK] Seq=1 Ack=2124 Win=10016 Len=2123 TSval=1232840334 TSecr=1091040680
  196 2.779371023 128.105.145.227 → 128.105.145.228 TCP 2189 6816 → 60426 [PSH, ACK] Seq=1 Ack=2124 Win=10016 Len=2123 TSval=1232840334 TSecr=1091040680
  197 2.779657696 128.105.145.228 → 128.105.145.227 TCP 1514 41406 → 6814 [ACK] Seq=1 Ack=1 Win=10226 Len=1448 TSval=1091040680 TSecr=1232836834
  198 2.779904311 128.105.145.228 → 128.105.145.227 TCP 741 41406 → 6814 [PSH, ACK] Seq=1449 Ack=1 Win=10226 Len=675 TSval=1091040680 TSecr=1232836834
  199 2.779926853 128.105.145.227 → 128.105.145.228 TCP 66 6814 → 41406 [ACK] Seq=1 Ack=2124 Win=10016 Len=0 TSval=1232840335 TSecr=1091040680
  200 2.780063638 128.105.145.227 → 128.105.145.228 TCP 2189 6814 → 41406 [PSH, ACK] Seq=1 Ack=2124 Win=10016 Len=2123 TSval=1232840335 TSecr=1091040680
  201 2.780711956 128.105.145.228 → 128.105.145.227 TCP 66 45786 → 6806 [ACK] Seq=2124 Ack=1449 Win=10016 Len=0 TSval=1091040681 TSecr=1232840334
  202 2.780712153 128.105.145.228 → 128.105.145.227 TCP 66 45786 → 6806 [ACK] Seq=2124 Ack=2124 Win=10016 Len=0 TSval=1091040681 TSecr=1232840334
  203 2.780726040 128.105.145.228 → 128.105.145.227 TCP 66 45566 → 6808 [ACK] Seq=2124 Ack=2124 Win=10008 Len=0 TSval=1091040681 TSecr=1232840334
  204 2.780726247 128.105.145.228 → 128.105.145.227 TCP 66 60426 → 6816 [ACK] Seq=2124 Ack=1449 Win=10226 Len=0 TSval=1091040681 TSecr=1232840334
  205 2.780726441 128.105.145.228 → 128.105.145.227 TCP 66 60426 → 6816 [ACK] Seq=2124 Ack=2124 Win=10226 Len=0 TSval=1091040681 TSecr=1232840334
  206 2.780734003 128.105.145.228 → 128.105.145.227 TCP 66 41406 → 6814 [ACK] Seq=2124 Ack=1449 Win=10226 Len=0 TSval=1091040682 TSecr=1232840335
  207 2.780974557 128.105.145.228 → 128.105.145.227 TCP 66 41406 → 6814 [ACK] Seq=2124 Ack=2124 Win=10226 Len=0 TSval=1091040682 TSecr=1232840335
  208 3.082095240 128.105.145.227 → 128.105.145.228 SSH 102 Client: Encrypted packet (len=36)
  209 3.082833656 128.105.145.227 → 128.105.145.228 SSH 102 Client: Encrypted packet (len=36)
  210 3.083037558 128.105.145.228 → 128.105.145.227 TCP 66 22 → 56858 [ACK] Seq=1 Ack=73 Win=840 Len=0 TSval=1091040984 TSecr=1232840637
  211 3.083249810 128.105.145.228 → 128.105.145.227 SSH 102 Server: Encrypted packet (len=36)
  212 3.083262130 128.105.145.227 → 128.105.145.228 TCP 66 56858 → 22 [ACK] Seq=73 Ack=37 Win=940 Len=0 TSval=1232840638 TSecr=1091040984
  213 3.091332174 128.105.145.227 → 128.105.145.228 SSH 102 Client: Encrypted packet (len=36)
  214 3.092085747 128.105.145.227 → 128.105.145.228 SSH 102 Client: Encrypted packet (len=36)
  215 3.092323571 128.105.145.228 → 128.105.145.227 TCP 66 22 → 56854 [ACK] Seq=1 Ack=73 Win=840 Len=0 TSval=1091040994 TSecr=1232840646
  216 3.092535152 128.105.145.228 → 128.105.145.227 SSH 102 Server: Encrypted packet (len=36)
  217 3.092547295 128.105.145.227 → 128.105.145.228 TCP 66 56854 → 22 [ACK] Seq=73 Ack=37 Win=940 Len=0 TSval=1232840647 TSecr=1091040994
  218 3.392710233 128.105.145.227 → 128.105.145.228 SSH 102 Client: Encrypted packet (len=36)
  219 3.393423690 128.105.145.227 → 128.105.145.228 SSH 102 Client: Encrypted packet (len=36)
  220 3.393657765 128.105.145.228 → 128.105.145.227 TCP 66 22 → 56876 [ACK] Seq=1 Ack=73 Win=901 Len=0 TSval=1091041295 TSecr=1232840948
  221 3.393870151 128.105.145.228 → 128.105.145.227 SSH 102 Server: Encrypted packet (len=36)
  222 3.393882527 128.105.145.227 → 128.105.145.228 TCP 66 56876 → 22 [ACK] Seq=73 Ack=37 Win=940 Len=0 TSval=1232840949 TSecr=1091041295
  223 3.451818782 128.105.145.227 → 128.105.145.228 SSH 102 Client: Encrypted packet (len=36)
  224 3.452342581 128.105.145.227 → 128.105.145.228 SSH 102 Client: Encrypted packet (len=36)
  225 3.452599911 128.105.145.228 → 128.105.145.227 TCP 66 22 → 56880 [ACK] Seq=1 Ack=73 Win=840 Len=0 TSval=1091041354 TSecr=1232841007
  226 3.452600049 128.105.145.228 → 128.105.145.227 SSH 102 Server: Encrypted packet (len=36)
  227 3.452624905 128.105.145.227 → 128.105.145.228 TCP 66 56880 → 22 [ACK] Seq=73 Ack=37 Win=940 Len=0 TSval=1232841007 TSecr=1091041354
  228 3.453855183 128.105.145.227 → 128.105.145.228 SSH 102 Client: Encrypted packet (len=36)
  229 3.454276245 128.105.145.227 → 128.105.145.228 SSH 102 Client: Encrypted packet (len=36)
  230 3.454513707 128.105.145.228 → 128.105.145.227 TCP 66 22 → 56874 [ACK] Seq=1 Ack=73 Win=840 Len=0 TSval=1091041356 TSecr=1232841009
  231 3.454726220 128.105.145.228 → 128.105.145.227 SSH 102 Server: Encrypted packet (len=36)
  232 3.454738195 128.105.145.227 → 128.105.145.228 TCP 66 56874 → 22 [ACK] Seq=73 Ack=37 Win=940 Len=0 TSval=1232841010 TSecr=1091041356
  233 3.556008969 128.105.145.228 → 128.105.145.227 TCP 1514 58346 → 6800 [ACK] Seq=1 Ack=1 Win=501 Len=1448 TSval=1091041457 TSecr=1232836113
  234 3.556035547 128.105.145.227 → 128.105.145.228 TCP 66 6800 → 58346 [ACK] Seq=1 Ack=1449 Win=1425 Len=0 TSval=1232841111 TSecr=1091041457
  235 3.556226357 128.105.145.228 → 128.105.145.227 TCP 1066 58346 → 6800 [PSH, ACK] Seq=1449 Ack=1 Win=501 Len=1000 TSval=1091041457 TSecr=1232836113
  236 3.556226561 128.105.145.228 → 128.105.145.227 TCP 1514 58346 → 6800 [ACK] Seq=2449 Ack=1 Win=501 Len=1448 TSval=1091041457 TSecr=1232836113
  237 3.556253079 128.105.145.227 → 128.105.145.228 TCP 66 6800 → 58346 [ACK] Seq=1 Ack=2449 Win=1425 Len=0 TSval=1232841111 TSecr=1091041457
  238 3.556272111 128.105.145.227 → 128.105.145.228 TCP 66 6800 → 58346 [ACK] Seq=1 Ack=3897 Win=1417 Len=0 TSval=1232841111 TSecr=1091041457
  239 3.556473875 128.105.145.228 → 128.105.145.227 TCP 2962 58346 → 6800 [ACK] Seq=3897 Ack=1 Win=501 Len=2896 TSval=1091041457 TSecr=1232836113
  240 3.556496998 128.105.145.227 → 128.105.145.228 TCP 66 6800 → 58346 [ACK] Seq=1 Ack=6793 Win=1417 Len=0 TSval=1232841111 TSecr=1091041457
  241 3.556717009 128.105.145.228 → 128.105.145.227 TCP 2962 58346 → 6800 [PSH, ACK] Seq=6793 Ack=1 Win=501 Len=2896 TSval=1091041457 TSecr=1232836113
  242 3.556742293 128.105.145.227 → 128.105.145.228 TCP 66 6800 → 58346 [ACK] Seq=1 Ack=9689 Win=1417 Len=0 TSval=1232841112 TSecr=1091041457
  243 3.556928990 128.105.145.228 → 128.105.145.227 TCP 1514 58346 → 6800 [ACK] Seq=9689 Ack=1 Win=501 Len=1448 TSval=1091041457 TSecr=1232836113
  244 3.556938964 128.105.145.227 → 128.105.145.228 TCP 66 6800 → 58346 [ACK] Seq=1 Ack=11137 Win=1425 Len=0 TSval=1232841112 TSecr=1091041457
  245 3.557181233 128.105.145.228 → 128.105.145.227 TCP 2962 58346 → 6800 [PSH, ACK] Seq=11137 Ack=1 Win=501 Len=2896 TSval=1091041457 TSecr=1232836113
  246 3.557196256 128.105.145.227 → 128.105.145.228 TCP 66 6800 → 58346 [ACK] Seq=1 Ack=14033 Win=1417 Len=0 TSval=1232841112 TSecr=1091041457
  247 3.557421460 128.105.145.228 → 128.105.145.227 TCP 2962 58346 → 6800 [PSH, ACK] Seq=14033 Ack=1 Win=501 Len=2896 TSval=1091041458 TSecr=1232841111
  248 3.557430822 128.105.145.227 → 128.105.145.228 TCP 66 6800 → 58346 [ACK] Seq=1 Ack=16929 Win=1417 Len=0 TSval=1232841112 TSecr=1091041458
  249 3.557672499 128.105.145.228 → 128.105.145.227 TCP 2962 58346 → 6800 [PSH, ACK] Seq=16929 Ack=1 Win=501 Len=2896 TSval=1091041458 TSecr=1232841111
  250 3.557688953 128.105.145.227 → 128.105.145.228 TCP 66 6800 → 58346 [ACK] Seq=1 Ack=19825 Win=1417 Len=0 TSval=1232841112 TSecr=1091041458
  251 3.557911794 128.105.145.228 → 128.105.145.227 TCP 2962 58346 → 6800 [PSH, ACK] Seq=19825 Ack=1 Win=501 Len=2896 TSval=1091041458 TSecr=1232841111
  252 3.557922811 128.105.145.227 → 128.105.145.228 TCP 66 6800 → 58346 [ACK] Seq=1 Ack=22721 Win=1417 Len=0 TSval=1232841113 TSecr=1091041458
  253 3.558165530 128.105.145.228 → 128.105.145.227 TCP 2962 58346 → 6800 [ACK] Seq=22721 Ack=1 Win=501 Len=2896 TSval=1091041458 TSecr=1232841112
  254 3.558178324 128.105.145.227 → 128.105.145.228 TCP 66 6800 → 58346 [ACK] Seq=1 Ack=25617 Win=1417 Len=0 TSval=1232841113 TSecr=1091041458
  255 3.558402044 128.105.145.228 → 128.105.145.227 TCP 2962 58346 → 6800 [ACK] Seq=25617 Ack=1 Win=501 Len=2896 TSval=1091041458 TSecr=1232841112
  256 3.558413603 128.105.145.227 → 128.105.145.228 TCP 66 6800 → 58346 [ACK] Seq=1 Ack=28513 Win=1417 Len=0 TSval=1232841113 TSecr=1091041458
  257 3.558655687 128.105.145.228 → 128.105.145.227 TCP 2914 58346 → 6800 [PSH, ACK] Seq=28513 Ack=1 Win=501 Len=2848 TSval=1091041458 TSecr=1232841112
  258 3.558670640 128.105.145.227 → 128.105.145.228 TCP 66 6800 → 58346 [ACK] Seq=1 Ack=31361 Win=1417 Len=0 TSval=1232841113 TSecr=1091041458
  259 4.231666661 128.105.145.227 → 128.105.145.228 SSH 102 Client: Encrypted packet (len=36)
  260 4.232432150 128.105.145.227 → 128.105.145.228 SSH 102 Client: Encrypted packet (len=36)
  261 4.232638371 128.105.145.228 → 128.105.145.227 TCP 66 22 → 49588 [ACK] Seq=1 Ack=73 Win=818 Len=0 TSval=1091042134 TSecr=1232841786
  262 4.232851502 128.105.145.228 → 128.105.145.227 SSH 94 Server: Encrypted packet (len=28)
  263 4.232866302 128.105.145.227 → 128.105.145.228 TCP 66 49588 → 22 [ACK] Seq=73 Ack=29 Win=906 Len=0 TSval=1232841788 TSecr=1091042134
  264 4.254790469 128.105.145.227 → 128.105.145.228 SSH 102 Client: Encrypted packet (len=36)
  265 4.255459024 128.105.145.227 → 128.105.145.228 SSH 102 Client: Encrypted packet (len=36)
  266 4.255634368 128.105.145.228 → 128.105.145.227 TCP 66 22 → 49594 [ACK] Seq=1 Ack=73 Win=818 Len=0 TSval=1091042157 TSecr=1232841810
  267 4.255872163 128.105.145.228 → 128.105.145.227 SSH 94 Server: Encrypted packet (len=28)
  268 4.255891834 128.105.145.227 → 128.105.145.228 TCP 66 49594 → 22 [ACK] Seq=73 Ack=29 Win=906 Len=0 TSval=1232841811 TSecr=1091042157
  269 4.270567773 128.105.145.227 → 128.105.145.228 SSH 102 Client: Encrypted packet (len=36)
  270 4.271066743 128.105.145.227 → 128.105.145.228 SSH 102 Client: Encrypted packet (len=36)
  271 4.271299688 128.105.145.228 → 128.105.145.227 TCP 66 22 → 56830 [ACK] Seq=1 Ack=73 Win=840 Len=0 TSval=1091042173 TSecr=1232841825
  272 4.271512596 128.105.145.228 → 128.105.145.227 SSH 94 Server: Encrypted packet (len=28)
  273 4.271524748 128.105.145.227 → 128.105.145.228 TCP 66 56830 → 22 [ACK] Seq=73 Ack=29 Win=940 Len=0 TSval=1232841826 TSecr=1091042173
  274 4.276205944 128.105.145.227 → 128.105.145.228 SSH 102 Client: Encrypted packet (len=36)
  275 4.276674544 128.105.145.227 → 128.105.145.228 SSH 102 Client: Encrypted packet (len=36)
  276 4.276871838 128.105.145.228 → 128.105.145.227 TCP 66 22 → 56838 [ACK] Seq=1 Ack=73 Win=840 Len=0 TSval=1091042178 TSecr=1232841831
  277 4.277085126 128.105.145.228 → 128.105.145.227 SSH 94 Server: Encrypted packet (len=28)
  278 4.277097072 128.105.145.227 → 128.105.145.228 TCP 66 56838 → 22 [ACK] Seq=73 Ack=29 Win=940 Len=0 TSval=1232841832 TSecr=1091042178
  279 4.298793503 128.105.145.227 → 128.105.145.228 SSH 102 Client: Encrypted packet (len=36)
  280 4.299194203 128.105.145.227 → 128.105.145.228 SSH 102 Client: Encrypted packet (len=36)
  281 4.299419383 128.105.145.228 → 128.105.145.227 TCP 66 22 → 56846 [ACK] Seq=1 Ack=73 Win=840 Len=0 TSval=1091042201 TSecr=1232841854
  282 4.299631675 128.105.145.228 → 128.105.145.227 SSH 94 Server: Encrypted packet (len=28)
  283 4.299645950 128.105.145.227 → 128.105.145.228 TCP 66 56846 → 22 [ACK] Seq=73 Ack=29 Win=940 Len=0 TSval=1232841854 TSecr=1091042201
  284 4.306447328 128.105.145.227 → 128.105.145.228 TCP 2189 43454 → 6812 [PSH, ACK] Seq=2124 Ack=2124 Win=10226 Len=2123 TSval=1232841861 TSecr=1091038709
  285 4.306461706 128.105.145.227 → 128.105.145.228 TCP 2189 53048 → 6804 [PSH, ACK] Seq=2124 Ack=2124 Win=10235 Len=2123 TSval=1232841861 TSecr=1091038709
  286 4.306477535 128.105.145.227 → 128.105.145.228 TCP 2189 34040 → 6806 [PSH, ACK] Seq=2124 Ack=2124 Win=10016 Len=2123 TSval=1232841861 TSecr=1091038709
  287 4.306483432 128.105.145.227 → 128.105.145.228 TCP 2189 33804 → 6814 [PSH, ACK] Seq=2124 Ack=2124 Win=10226 Len=2123 TSval=1232841861 TSecr=1091038709
  288 4.307584209 128.105.145.228 → 128.105.145.227 TCP 66 6812 → 43454 [ACK] Seq=2124 Ack=4247 Win=10016 Len=0 TSval=1091042209 TSecr=1232841861
  289 4.307843756 128.105.145.228 → 128.105.145.227 TCP 1514 6812 → 43454 [ACK] Seq=2124 Ack=4247 Win=10016 Len=1448 TSval=1091042209 TSecr=1232841861
  290 4.307856133 128.105.145.227 → 128.105.145.228 TCP 66 43454 → 6812 [ACK] Seq=4247 Ack=3572 Win=10226 Len=0 TSval=1232841863 TSecr=1091042209
  291 4.308074914 128.105.145.228 → 128.105.145.227 TCP 741 6812 → 43454 [PSH, ACK] Seq=3572 Ack=4247 Win=10016 Len=675 TSval=1091042209 TSecr=1232841861
  292 4.308083462 128.105.145.227 → 128.105.145.228 TCP 66 43454 → 6812 [ACK] Seq=4247 Ack=4247 Win=10226 Len=0 TSval=1232841863 TSecr=1091042209
  293 4.308199707 128.105.145.228 → 128.105.145.227 TCP 66 6804 → 53048 [ACK] Seq=2124 Ack=4247 Win=10016 Len=0 TSval=1091042209 TSecr=1232841861
  294 4.308407910 128.105.145.228 → 128.105.145.227 TCP 2189 6804 → 53048 [PSH, ACK] Seq=2124 Ack=4247 Win=10016 Len=2123 TSval=1091042209 TSecr=1232841861
  295 4.308431517 128.105.145.227 → 128.105.145.228 TCP 66 53048 → 6804 [ACK] Seq=4247 Ack=4247 Win=10219 Len=0 TSval=1232841863 TSecr=1091042209
  296 4.308501477 128.105.145.228 → 128.105.145.227 TCP 66 6814 → 33804 [ACK] Seq=2124 Ack=4247 Win=10214 Len=0 TSval=1091042210 TSecr=1232841861
  297 4.308594195 128.105.145.228 → 128.105.145.227 TCP 66 6806 → 34040 [ACK] Seq=2124 Ack=4247 Win=10016 Len=0 TSval=1091042210 TSecr=1232841861
  298 4.308810013 128.105.145.228 → 128.105.145.227 TCP 2189 6806 → 34040 [PSH, ACK] Seq=2124 Ack=4247 Win=10016 Len=2123 TSval=1091042210 TSecr=1232841861
